question,query
Which Chess players died in the same place they were born in? <pad> PRON NOUN NOUN VERB ADP DET ADJ NOUN PRON AUX VERB ADP PUNCT <pad> dobj compound nsubj ROOT prep det amod pobj nsubjpass auxpass relcl prep punct <pad> 2 3 2 1 2 4 4 3 5 5 4 5 2 <pad> ,SELECT DISTINCT var_uri WHERE bra_open var_uri a dbo_ChessPlayer ; dbo_birthPlace var_x ; dbo_deathPlace var_y FILTER ( var_x = var_y ) bra_close 
"Welche Schachspieler sind am gleichen Ort gestorben, an dem sie geboren wurden? <pad> DET NOUN AUX ADP ADJ NOUN VERB PUNCT ADP PRON PRON VERB AUX PUNCT <pad> nk sb ROOT mo nk nk oc punct mo nk sb oc rc punct <pad> 3 2 1 3 5 4 2 3 7 8 6 6 5 2 <pad> ",SELECT DISTINCT var_uri WHERE bra_open var_uri a dbo_ChessPlayer ; dbo_birthPlace var_x ; dbo_deathPlace var_y FILTER ( var_x = var_y ) bra_close 
Quels joueurs d'échecs sont morts au même endroit où ils sont nés ? <pad> ADJ NOUN ADP NOUN AUX VERB ADP ADJ NOUN PRON PRON AUX VERB PUNCT <pad> amod nsubj:pass case nmod aux:pass ROOT case amod obl:mod iobj nsubj aux:tense acl:relcl punct <pad> 3 2 4 3 2 1 3 3 2 4 4 4 3 2 <pad> ,SELECT DISTINCT var_uri WHERE bra_open var_uri a dbo_ChessPlayer ; dbo_birthPlace var_x ; dbo_deathPlace var_y FILTER ( var_x = var_y ) bra_close 
Who is the owner of Facebook? <pad> PRON AUX DET NOUN ADP PROPN PUNCT <pad> attr ROOT det nsubj prep pobj punct <pad> 2 1 3 2 3 4 2 <pad> dbr_Facebook,SELECT DISTINCT var_uri WHERE bra_open dbr_Facebook dbo_foundedBy var_uri bra_close 
Wem gehört Facebook? <pad> PROPN VERB PROPN PUNCT <pad> sb ROOT oa punct <pad> 2 1 2 2 <pad> dbr_Facebook,SELECT DISTINCT var_uri WHERE bra_open dbr_Facebook dbo_foundedBy var_uri bra_close 
Qui est le propriétaire de Facebook ? <pad> PRON AUX DET NOUN ADP PROPN PUNCT <pad> nsubj cop det ROOT case nmod punct <pad> 2 2 2 1 3 2 2 <pad> dbr_Facebook,SELECT DISTINCT var_uri WHERE bra_open dbr_Facebook dbo_foundedBy var_uri bra_close 
Give me all movies with Tom Cruise. <pad> VERB PRON DET NOUN ADP PROPN PROPN PUNCT <pad> ROOT dative det dobj prep compound pobj punct <pad> 1 2 3 2 3 5 4 2 <pad> dbr_Tom_Cruise,SELECT DISTINCT var_uri WHERE bra_open var_uri a dbo_Film ; dbo_starring dbr_Tom_Cruise bra_close 
In welchen Filmen hat Tom Cruise mitgespielt? <pad> ADP DET NOUN AUX PROPN PROPN VERB PUNCT <pad> mo nk nk ROOT pnc sb oc punct <pad> 3 5 4 1 3 2 2 2 <pad> dbr_Tom_Cruise,SELECT DISTINCT var_uri WHERE bra_open var_uri a dbo_Film ; dbo_starring dbr_Tom_Cruise bra_close 
Donnez-moi tous les films de Tom Cruise. <pad> PROPN PRON ADJ DET NOUN ADP PROPN PROPN PUNCT <pad> ROOT dep amod det ROOT case nmod nmod punct <pad> 1 2 -1 -1 -1 -1 -1 -1 -1 <pad> dbr_Tom_Cruise,SELECT DISTINCT var_uri WHERE bra_open var_uri a dbo_Film ; dbo_starring dbr_Tom_Cruise bra_close 
In which U.S. state is Fort Knox located? <pad> ADP PRON PROPN NOUN AUX PROPN PROPN VERB PUNCT <pad> prep pobj compound nsubj ROOT compound nsubj acomp punct <pad> 2 3 3 2 1 4 3 2 2 <pad> res_Fort_Knox res_United_States,SELECT DISTINCT var_uri WHERE bra_open res_Fort_Knox dbo_location var_uri sep_dot var_uri dbo_country res_United_States bra_close 
Zu welchem Bundesstaat gehört Fort Knox? <pad> ADP DET NOUN VERB NOUN PROPN PUNCT <pad> op nk nk ROOT pnc sb punct <pad> 2 4 3 1 3 2 2 <pad> res_Fort_Knox res_United_States,SELECT DISTINCT var_uri WHERE bra_open res_Fort_Knox dbo_location var_uri sep_dot var_uri dbo_country res_United_States bra_close 
Dans quel État américain se trouve Fort Knox ? <pad> ADP DET NOUN ADJ PRON VERB ADV PROPN PUNCT <pad> case det nsubj amod expl:comp ROOT obl:arg flat:name punct <pad> 3 3 2 3 2 1 2 3 2 <pad> res_Fort_Knox res_United_States,SELECT DISTINCT var_uri WHERE bra_open res_Fort_Knox dbo_location var_uri sep_dot var_uri dbo_country res_United_States bra_close 
Give me all cities in New Jersey with more than 100000 inhabitants. <pad> VERB PRON DET NOUN ADP PROPN PROPN ADP ADJ ADP NUM NOUN PUNCT <pad> ROOT dative det dobj prep compound pobj prep amod quantmod nummod pobj punct <pad> 1 2 3 2 3 5 4 2 5 5 4 3 2 <pad> res_New_Jersey,SELECT DISTINCT var_uri WHERE bra_open var_uri rdf_type dbo_City ; dbo_isPartOf res_New_Jersey ; dbo_populationTotal var_inhabitants FILTER ( var_inhabitants > 100000 ) bra_close 
Liste alle Städte mit einer Einwohnerzahl größer als 100000 in New Jersey auf. <pad> NOUN DET NOUN ADP DET NOUN ADV ADP NUM ADP PROPN PROPN ADP PUNCT <pad> ROOT nk sb mnr nk nk pd cm cc mnr pnc nk ROOT ROOT <pad> 1 3 2 3 5 4 2 4 3 2 4 3 -1 -1 <pad> res_New_Jersey,SELECT DISTINCT var_uri WHERE bra_open var_uri rdf_type dbo_City ; dbo_isPartOf res_New_Jersey ; dbo_populationTotal var_inhabitants FILTER ( var_inhabitants > 100000 ) bra_close 
Donnez-moi toutes les villes du New Jersey ayant plus de 100000 habitants. <pad> PROPN PRON ADJ DET NOUN ADP PROPN PROPN AUX ADV ADP NUM NOUN PUNCT <pad> ROOT dep amod det nsubj case nmod flat:name acl advmod fixed nummod obj punct <pad> 1 2 4 4 3 5 4 5 2 5 6 4 3 2 <pad> res_New_Jersey,SELECT DISTINCT var_uri WHERE bra_open var_uri rdf_type dbo_City ; dbo_isPartOf res_New_Jersey ; dbo_populationTotal var_inhabitants FILTER ( var_inhabitants > 100000 ) bra_close 
Which mountains are higher than the Nanga Parbat? <pad> DET NOUN AUX ADJ ADP DET PROPN PROPN PUNCT <pad> det nsubj ROOT acomp prep det compound pobj punct <pad> 3 2 1 2 3 5 5 4 2 <pad> dbr_Nanga_Parbat,SELECT DISTINCT var_uri WHERE bra_open dbr_Nanga_Parbat dbo_elevation var_elevation sep_dot var_uri a dbo_Mountain bra_open var_uri dbo_elevation var_otherelevation bra_close UNION bra_open var_uri dbp_elevationM var_otherelevation bra_close FILTER ( var_otherelevation > var_elevation ) bra_close 
"Liste alle Berge auf, die größer als der Nanga Parbat sind. <pad> NOUN DET NOUN ADP PUNCT PRON ADV ADP DET NOUN PROPN AUX PUNCT <pad> ROOT nk oa svp punct sb pd cm nk pnc cc rc punct <pad> 1 3 2 2 2 3 3 6 6 5 4 2 2 <pad> dbr_Nanga_Parbat",SELECT DISTINCT var_uri WHERE bra_open dbr_Nanga_Parbat dbo_elevation var_elevation sep_dot var_uri a dbo_Mountain bra_open var_uri dbo_elevation var_otherelevation bra_close UNION bra_open var_uri dbp_elevationM var_otherelevation bra_close FILTER ( var_otherelevation > var_elevation ) bra_close 
Quelles montagnes sont plus hautes que le Nanga Parbat ? <pad> DET NOUN AUX ADV NOUN SCONJ DET PROPN PROPN PUNCT <pad> det nsubj cop advmod ROOT mark det dep flat:name punct <pad> 3 2 2 2 1 3 3 2 3 2 <pad> dbr_Nanga_Parbat,SELECT DISTINCT var_uri WHERE bra_open dbr_Nanga_Parbat dbo_elevation var_elevation sep_dot var_uri a dbo_Mountain bra_open var_uri dbo_elevation var_otherelevation bra_close UNION bra_open var_uri dbp_elevationM var_otherelevation bra_close FILTER ( var_otherelevation > var_elevation ) bra_close 
Give me all B-sides of the Ramones. <pad> VERB PRON DET NOUN PUNCT NOUN ADP DET PROPN PUNCT <pad> ROOT dative det compound punct dobj prep det pobj punct <pad> 1 2 3 3 3 2 3 5 4 2 <pad> dbr_Ramones,SELECT DISTINCT var_string WHERE bra_open var_x dbo_musicalArtist dbr_Ramones ; dbo_bSide var_string bra_close 
Liste alle B-Seiten der Ramones auf. <pad> NOUN DET NOUN DET NOUN ADP PUNCT <pad> ROOT nk oa nk ag svp punct <pad> 1 3 2 4 3 2 2 <pad> dbr_Ramones,SELECT DISTINCT var_string WHERE bra_open var_x dbo_musicalArtist dbr_Ramones ; dbo_bSide var_string bra_close 
Donnez-moi toutes les faces B des Ramones. <pad> PROPN PRON ADJ DET NOUN NOUN ADP NOUN PUNCT <pad> ROOT dep amod det amod nmod case nmod punct <pad> 1 2 3 3 2 3 5 4 2 <pad> dbr_Ramones,SELECT DISTINCT var_string WHERE bra_open var_x dbo_musicalArtist dbr_Ramones ; dbo_bSide var_string bra_close 
What are the specialities of the UNC Health Care? <pad> PRON AUX DET NOUN ADP DET PROPN PROPN PROPN PUNCT <pad> attr ROOT det nsubj prep det compound compound pobj punct <pad> 2 1 3 2 3 5 5 5 4 2 <pad> dbr_UNC_Health_Care,SELECT DISTINCT var_uri WHERE bra_open dbr_UNC_Health_Care dbp_speciality var_uri bra_close 
Welches sind die Fachgebiete des UNC Health Care? <pad> PRON AUX DET NOUN DET PROPN PROPN PROPN PUNCT <pad> pd ROOT nk sb nk ag pnc nk punct <pad> 2 1 3 2 4 3 5 4 2 <pad> dbr_UNC_Health_Care,SELECT DISTINCT var_uri WHERE bra_open dbr_UNC_Health_Care dbp_speciality var_uri bra_close 
When was Olof Palme shot? <pad> SCONJ AUX PROPN PROPN VERB PUNCT <pad> advmod auxpass compound nsubj ROOT punct <pad> 3 2 3 2 1 2 <pad> dbr_Olof_Palme,SELECT DISTINCT var_date WHERE bra_open dbr_Olof_Palme dbo_deathDate var_date bra_close 
Wann wurde Olof Palme erschossen? <pad> ADV AUX PROPN PROPN VERB PUNCT <pad> mo ROOT pnc sb oc punct <pad> 3 1 3 2 2 2 <pad> dbr_Olof_Palme,SELECT DISTINCT var_date WHERE bra_open dbr_Olof_Palme dbo_deathDate var_date bra_close 
Quand Olof Palme a-t-il été abattu ? <pad> SCONJ PROPN PROPN AUX PRON PRON AUX VERB PUNCT <pad> mark det nsubj:pass aux:tense expl:subj expl:subj aux:pass ROOT punct <pad> 2 3 2 2 2 2 2 1 2 <pad> dbr_Olof_Palme,SELECT DISTINCT var_date WHERE bra_open dbr_Olof_Palme dbo_deathDate var_date bra_close 
List the seven kings of Rome. <pad> VERB DET NUM NOUN ADP PROPN PUNCT <pad> ROOT det nummod dobj prep pobj punct <pad> 1 3 3 2 3 4 2 <pad> dbr_King_of_Rome,SELECT DISTINCT var_uri WHERE bra_open var_uri dbp_title dbr_King_of_Rome bra_close 
Liste die sieben Könige Roms auf. <pad> NOUN DET NUM NOUN PROPN ADP PUNCT <pad> ROOT nk nk pnc ag svp punct <pad> 1 4 4 3 2 2 2 <pad> dbr_King_of_Rome,SELECT DISTINCT var_uri WHERE bra_open var_uri dbp_title dbr_King_of_Rome bra_close 
Énumérez les sept rois de Rome. <pad> PRON DET NUM NOUN ADP PROPN PUNCT <pad> ROOT det nummod dep case nmod punct <pad> 1 3 3 2 4 3 2 <pad> dbr_King_of_Rome,SELECT DISTINCT var_uri WHERE bra_open var_uri dbp_title dbr_King_of_Rome bra_close 
Give me all people that were born in Vienna and died in Berlin. <pad> VERB PRON DET NOUN PRON AUX VERB ADP PROPN CCONJ VERB ADP PROPN PUNCT <pad> ROOT dative det dobj nsubjpass auxpass relcl prep pobj cc conj prep pobj punct <pad> 1 2 3 2 4 4 3 4 5 4 4 5 6 2 <pad> dbr_Vienna dbr_Berlin,SELECT DISTINCT var_uri WHERE bra_open var_uri dbo_birthPlace dbr_Vienna ; dbo_deathPlace dbr_Berlin bra_close 
"Liste alle Menschen auf, die in Wien geboren und in Berlin gestorben sind. <pad> NOUN DET NOUN ADP PUNCT PRON ADP PROPN VERB CCONJ ADP PROPN VERB AUX PUNCT <pad> ROOT nk oa svp punct sb mo nk oc cd mo nk cj rc punct <pad> 1 3 2 2 2 3 4 5 3 4 6 7 5 2 2 <pad> dbr_Vienna dbr_Berlin",SELECT DISTINCT var_uri WHERE bra_open var_uri dbo_birthPlace dbr_Vienna ; dbo_deathPlace dbr_Berlin bra_close 
Donnez-moi toutes les personnes nées à Vienne et mortes à Berlin. <pad> PROPN PRON ADJ DET NOUN VERB ADP NOUN CCONJ VERB ADP PROPN PUNCT <pad> ROOT dep amod det ROOT acl case obl:arg cc conj case nmod punct <pad> 1 2 -1 -1 -1 -1 -1 -1 -1 -1 -1 -1 -1 <pad> dbr_Vienna dbr_Berlin,SELECT DISTINCT var_uri WHERE bra_open var_uri dbo_birthPlace dbr_Vienna ; dbo_deathPlace dbr_Berlin bra_close 
Is Darth Vader Luke’s father? <pad> AUX PROPN PROPN PROPN PART NOUN PUNCT <pad> ROOT compound compound poss case nsubj punct <pad> 1 4 4 3 4 2 2 <pad> dbr_Darth_Vader dbr_Luke_Skywalker,ASK WHERE bra_open dbr_Darth_Vader dbo_child dbr_Luke_Skywalker bra_close 
Ist Darth Vader der Vater von Luke? <pad> AUX PROPN PROPN DET NOUN ADP PROPN PUNCT <pad> ROOT pnc sb nk pd pg nk punct <pad> 1 3 2 3 2 3 4 2 <pad> dbr_Darth_Vader dbr_Luke_Skywalker,ASK WHERE bra_open dbr_Darth_Vader dbo_child dbr_Luke_Skywalker bra_close 
Luke est-il le père de Dark Vador ? <pad> PROPN AUX PRON DET NOUN ADP PROPN PROPN PUNCT <pad> nsubj cop dep det ROOT case nmod nmod punct <pad> 2 2 3 2 1 3 2 2 2 <pad> dbr_Darth_Vader dbr_Luke_Skywalker,ASK WHERE bra_open dbr_Darth_Vader dbo_child dbr_Luke_Skywalker bra_close 
Show me all the breweries in Australia. <pad> VERB PRON DET DET NOUN ADP PROPN PUNCT <pad> ROOT dative predet det dobj prep pobj punct <pad> 1 2 3 3 2 3 4 2 <pad> dbr_Australia dbr_Australia,SELECT DISTINCT var_uri WHERE bra_open var_uri a dbo_Brewery bra_open var_uri dbo_location dbr_Australia bra_close UNION bra_open var_uri dbo_location var_x sep_dot var_x dbo_country dbr_Australia bra_close bra_close 
Liste alle Brauereinen in Australien auf. <pad> NOUN DET NOUN ADP PROPN ADP PUNCT <pad> ROOT nk ROOT mnr nk svp punct <pad> 1 -1 -1 -1 -1 -1 -1 <pad> dbr_Australia dbr_Australia,SELECT DISTINCT var_uri WHERE bra_open var_uri a dbo_Brewery bra_open var_uri dbo_location dbr_Australia bra_close UNION bra_open var_uri dbo_location var_x sep_dot var_x dbo_country dbr_Australia bra_close bra_close 
Montrez-moi toutes les brasseries d'Australie. <pad> PROPN PRON ADJ DET NOUN ADP PROPN PUNCT <pad> ROOT dep amod det dep case nmod punct <pad> 1 2 3 3 2 4 3 2 <pad> dbr_Australia dbr_Australia,SELECT DISTINCT var_uri WHERE bra_open var_uri a dbo_Brewery bra_open var_uri dbo_location dbr_Australia bra_close UNION bra_open var_uri dbo_location var_x sep_dot var_x dbo_country dbr_Australia bra_close bra_close 
Give me all films produced by Steven Spielberg with a budget of at least $80 million. <pad> VERB PRON DET NOUN VERB ADP PROPN PROPN ADP DET NOUN ADP ADV ADV SYM NUM NUM PUNCT <pad> ROOT dative det dobj acl agent compound pobj prep det pobj prep advmod advmod quantmod compound pobj punct <pad> 1 2 3 2 3 4 6 5 4 6 5 6 9 8 8 8 7 2 <pad> dbr_Steven_Spielberg,SELECT DISTINCT var_uri WHERE bra_open var_uri rdf_type dbo_Film sep_dot var_uri dbo_director dbr_Steven_Spielberg sep_dot var_uri dbo_budget var_b sep_dot FILTER( xsd_double( var_b) >= 8.0E7 ) bra_close 
Liste alle von Steven Spielberg produzierten Filme mit einem Budget von mindestens 80 Millionen Dollar auf. <pad> NOUN PRON ADP PROPN PROPN ADJ NOUN ADP DET NOUN ADP ADV NUM NOUN NOUN ADP PUNCT <pad> ROOT nk sbp pnc nk nk ag mnr nk nk mnr mo nmc nk nk mo punct <pad> 1 3 4 6 5 3 2 3 5 4 5 7 7 6 7 2 2 <pad> dbr_Steven_Spielberg,SELECT DISTINCT var_uri WHERE bra_open var_uri rdf_type dbo_Film sep_dot var_uri dbo_director dbr_Steven_Spielberg sep_dot var_uri dbo_budget var_b sep_dot FILTER( xsd_double( var_b) >= 8.0E7 ) bra_close 
Donnez-moi tous les films produits par Steven Spielberg avec un budget d'au moins 80 millions de dollars. <pad> PROPN PRON ADJ DET NOUN VERB ADP PROPN PROPN ADP DET NOUN ADP ADP ADV NUM NOUN ADP NOUN PUNCT <pad> ROOT dep amod det flat:name acl case obl:agent flat:name case det obl:mod case advmod fixed nummod nmod case nmod punct <pad> 1 2 3 3 2 3 5 4 5 5 5 4 6 6 7 6 5 7 6 2 <pad> dbr_Steven_Spielberg,SELECT DISTINCT var_uri WHERE bra_open var_uri rdf_type dbo_Film sep_dot var_uri dbo_director dbr_Steven_Spielberg sep_dot var_uri dbo_budget var_b sep_dot FILTER( xsd_double( var_b) >= 8.0E7 ) bra_close 
Give me all soccer clubs in Spain. <pad> VERB PRON DET NOUN NOUN ADP PROPN PUNCT <pad> ROOT dative det compound dobj prep pobj punct <pad> 1 2 3 3 2 3 4 2 <pad> dbr_Spain,"SELECT DISTINCT var_uri WHERE bra_open var_uri a dbo_SoccerClub bra_open var_uri dbo_ground dbr_Spain bra_close UNION bra_open var_uri dbp_ground var_ground FILTER regex( var_ground, ""Spain"") bra_close bra_close "
Liste alle Fußballvereine aus Spanien auf. <pad> NOUN DET NOUN ADP PROPN ADP PUNCT <pad> ROOT nk pd mnr nk svp punct <pad> 1 3 2 3 4 2 2 <pad> dbr_Spain,"SELECT DISTINCT var_uri WHERE bra_open var_uri a dbo_SoccerClub bra_open var_uri dbo_ground dbr_Spain bra_close UNION bra_open var_uri dbp_ground var_ground FILTER regex( var_ground, ""Spain"") bra_close bra_close "
Quels sont tous les clubs de football en Espagne ? <pad> ADJ AUX ADJ DET NOUN ADP NOUN ADP NOUN PUNCT <pad> ROOT dep amod det nsubj case nmod case nmod punct <pad> 1 2 3 3 2 4 3 4 3 2 <pad> dbr_Spain,"SELECT DISTINCT var_uri WHERE bra_open var_uri a dbo_SoccerClub bra_open var_uri dbo_ground dbr_Spain bra_close UNION bra_open var_uri dbp_ground var_ground FILTER regex( var_ground, ""Spain"") bra_close bra_close "
Who produced films starring Natalie Portman? <pad> PRON VERB NOUN VERB PROPN PROPN PUNCT <pad> nsubj ROOT dobj acl compound dobj punct <pad> 2 1 2 3 5 4 2 <pad> dbr_Natalie_Portman,SELECT DISTINCT var_uri WHERE bra_open var_film a dbo_Film ; dbo_starring dbr_Natalie_Portman ; dbo_producer var_uri bra_close 
"Wer hat die Filme, in denen Natalie Portman mitspielt, produziert? <pad> PRON VERB DET NOUN PUNCT ADP PRON NOUN PROPN VERB PUNCT VERB PUNCT <pad> sb ROOT nk oa punct mo nk sb nk rc punct oc punct <pad> 2 1 4 3 4 5 6 5 6 4 3 2 2 <pad> dbr_Natalie_Portman",SELECT DISTINCT var_uri WHERE bra_open var_film a dbo_Film ; dbo_starring dbr_Natalie_Portman ; dbo_producer var_uri bra_close 
Qui à produit les films avec Natalie Portman ? <pad> PRON ADP NOUN DET NOUN ADP PROPN PROPN PUNCT <pad> nsubj case dep det ROOT case nmod flat:name punct <pad> 2 4 3 2 1 3 2 3 2 <pad> dbr_Natalie_Portman,SELECT DISTINCT var_uri WHERE bra_open var_film a dbo_Film ; dbo_starring dbr_Natalie_Portman ; dbo_producer var_uri bra_close 
Give me all breeds of the German Shepherd dog. <pad> VERB PRON DET NOUN ADP DET ADJ PROPN NOUN PUNCT <pad> ROOT dative det dobj prep det amod compound pobj punct <pad> 1 2 3 2 3 5 5 5 4 2 <pad> dbr_German_Shepherd,SELECT DISTINCT var_uri WHERE bra_open var_uri dbp_breed dbr_German_Shepherd bra_close 
Liste alle Züchtungen vom Deutschen Schäferhund auf. <pad> NOUN DET NOUN ADP ADJ NOUN ADP PUNCT <pad> ROOT nk pd mnr nk nk svp punct <pad> 1 3 2 3 5 4 2 2 <pad> dbr_German_Shepherd,SELECT DISTINCT var_uri WHERE bra_open var_uri dbp_breed dbr_German_Shepherd bra_close 
Donnez-moi toutes les races de berger allemand. <pad> PROPN PRON ADJ DET NOUN ADP VERB ADJ PUNCT <pad> ROOT dep amod det flat:name mark acl amod punct <pad> 1 2 3 3 2 4 3 4 2 <pad> dbr_German_Shepherd,SELECT DISTINCT var_uri WHERE bra_open var_uri dbp_breed dbr_German_Shepherd bra_close 
Who is the heaviest player of the Chicago Bulls? <pad> PRON AUX DET ADJ NOUN ADP DET PROPN PROPN PUNCT <pad> attr ROOT det amod nsubj prep det compound pobj punct <pad> 2 1 3 3 2 3 5 5 4 2 <pad> dbr_Chicago_Bulls dbr_Chicago_Bulls dbr_Chicago_Bulls,SELECT DISTINCT var_uri WHERE bra_open var_uri a dbo_Person ; dbo_weight var_num bra_open var_uri dbp_team dbr_Chicago_Bulls bra_close UNION bra_open var_uri dbp_draftTeam dbr_Chicago_Bulls bra_close UNION bra_open var_uri dbo_draftTeam dbr_Chicago_Bulls bra_close bra_close ORDER BY DESC( var_num) OFFSET 0 LIMIT 1
Wer ist der schwerste Spieler der Chicago Bulls? <pad> PRON AUX DET ADJ NOUN DET PROPN PROPN PUNCT <pad> sb ROOT nk nk pd nk pnc ag punct <pad> 2 1 3 3 2 4 4 3 2 <pad> dbr_Chicago_Bulls dbr_Chicago_Bulls dbr_Chicago_Bulls,SELECT DISTINCT var_uri WHERE bra_open var_uri a dbo_Person ; dbo_weight var_num bra_open var_uri dbp_team dbr_Chicago_Bulls bra_close UNION bra_open var_uri dbp_draftTeam dbr_Chicago_Bulls bra_close UNION bra_open var_uri dbo_draftTeam dbr_Chicago_Bulls bra_close bra_close ORDER BY DESC( var_num) OFFSET 0 LIMIT 1
Qui est le joueur qui pèse le plus dans les Chicago Bulls ? <pad> PRON AUX DET NOUN PRON VERB DET ADV ADP DET NOUN PROPN PUNCT <pad> nsubj cop det ROOT nsubj acl:relcl det obj case det obl:arg nmod punct <pad> 2 2 2 1 3 2 4 3 4 4 3 4 2 <pad> dbr_Chicago_Bulls dbr_Chicago_Bulls dbr_Chicago_Bulls,SELECT DISTINCT var_uri WHERE bra_open var_uri a dbo_Person ; dbo_weight var_num bra_open var_uri dbp_team dbr_Chicago_Bulls bra_close UNION bra_open var_uri dbp_draftTeam dbr_Chicago_Bulls bra_close UNION bra_open var_uri dbo_draftTeam dbr_Chicago_Bulls bra_close bra_close ORDER BY DESC( var_num) OFFSET 0 LIMIT 1
Which languages are spoken in Estonia? <pad> DET NOUN AUX VERB ADP PROPN PUNCT <pad> det nsubjpass auxpass ROOT prep pobj punct <pad> 3 2 2 1 2 3 2 <pad> dbr_Estonia,SELECT DISTINCT var_uri WHERE bra_open var_uri dbo_spokenIn dbr_Estonia bra_close 
Welche Sprachen werden in Estland gesprochen? <pad> DET NOUN AUX ADP PROPN VERB PUNCT <pad> nk sb ROOT mo nk oc punct <pad> 3 2 1 3 4 2 2 <pad> dbr_Estonia,SELECT DISTINCT var_uri WHERE bra_open var_uri dbo_spokenIn dbr_Estonia bra_close 
What is the largest country in the world? <pad> PRON AUX DET ADJ NOUN ADP DET NOUN PUNCT <pad> attr ROOT det amod nsubj prep det pobj punct <pad> 2 1 3 3 2 3 5 4 2 <pad> ,SELECT DISTINCT var_uri WHERE bra_open var_uri rdf_type dbo_Country ; dbo_areaTotal var_n bra_close ORDER BY DESC( var_n) OFFSET 0 LIMIT 1
Welches ist das größte Land der Welt? <pad> PRON AUX DET ADJ NOUN DET NOUN PUNCT <pad> sb ROOT nk nk pd nk ag punct <pad> 2 1 3 3 2 4 3 2 <pad> ,SELECT DISTINCT var_uri WHERE bra_open var_uri rdf_type dbo_Country ; dbo_areaTotal var_n bra_close ORDER BY DESC( var_n) OFFSET 0 LIMIT 1
Quel est le plus grand pays du monde ? <pad> ADJ AUX DET ADV ADJ NOUN ADP NOUN PUNCT <pad> ROOT dep det advmod amod nsubj case nmod punct <pad> 1 2 3 4 3 2 4 3 2 <pad> ,SELECT DISTINCT var_uri WHERE bra_open var_uri rdf_type dbo_Country ; dbo_areaTotal var_n bra_close ORDER BY DESC( var_n) OFFSET 0 LIMIT 1
What is the largest city in america? <pad> PRON AUX DET ADJ NOUN ADP PROPN PUNCT <pad> attr ROOT det amod nsubj prep pobj punct <pad> 2 1 3 3 2 3 4 2 <pad> dbr_United_States,SELECT var_lcity WHERE bra_open dbr_United_States dbo_largestCity var_lcity bra_close 
Wie heißt die größte Stadt in Amerika? <pad> ADV VERB DET ADJ NOUN ADP PROPN PUNCT <pad> mo ROOT nk nk sb mnr nk punct <pad> 2 1 3 3 2 3 4 2 <pad> dbr_United_States,SELECT var_lcity WHERE bra_open dbr_United_States dbo_largestCity var_lcity bra_close 
Quelle est la plus grande ville d'Amérique ? <pad> ADJ AUX DET ADV ADJ NOUN ADP PROPN PUNCT <pad> ROOT dep det advmod amod nsubj case nmod punct <pad> 1 2 3 4 3 2 4 3 2 <pad> dbr_United_States,SELECT var_lcity WHERE bra_open dbr_United_States dbo_largestCity var_lcity bra_close 
Who was the pope that founded the Vatican Television? <pad> PRON AUX DET NOUN PRON VERB DET PROPN PROPN PUNCT <pad> attr ROOT det nsubj nsubj relcl det compound dobj punct <pad> 2 1 3 2 4 3 5 5 4 2 <pad> res_Vatican_Television_Center,SELECT var_uri WHERE bra_open var_uri rdf_type dbo_Pope sep_dot res_Vatican_Television_Center dbo_foundedBy var_uri bra_close 
Welcher Papst hat das Vatican Television erfunden? <pad> DET NOUN AUX DET ADJ NOUN VERB PUNCT <pad> nk sb ROOT nk nk oa oc punct <pad> 3 2 1 4 4 3 2 2 <pad> res_Vatican_Television_Center,SELECT var_uri WHERE bra_open var_uri rdf_type dbo_Pope sep_dot res_Vatican_Television_Center dbo_foundedBy var_uri bra_close 
Qui était le pape qui a fondé la télévision du Vatican ? <pad> PRON AUX DET NOUN PRON AUX VERB DET NOUN ADP PROPN PUNCT <pad> nsubj cop det ROOT nsubj aux:tense acl:relcl det obj case nmod punct <pad> 2 2 2 1 3 3 2 4 3 5 4 2 <pad> res_Vatican_Television_Center,SELECT var_uri WHERE bra_open var_uri rdf_type dbo_Pope sep_dot res_Vatican_Television_Center dbo_foundedBy var_uri bra_close 
Who discovered Ceres? <pad> PRON VERB NOUN PUNCT <pad> nsubj ROOT dobj punct <pad> 2 1 2 2 <pad> dbr_Cedbr_,SELECT DISTINCT var_uri WHERE bra_open dbr_Cedbr_(dwarf_planet) dbo_discoverer var_uri bra_close 
Wer hat Ceres entdeckt? <pad> PRON AUX PROPN VERB PUNCT <pad> sb ROOT oa oc punct <pad> 2 1 3 2 2 <pad> dbr_Cedbr_,SELECT DISTINCT var_uri WHERE bra_open dbr_Cedbr_(dwarf_planet) dbo_discoverer var_uri bra_close 
Qui a découvert Cérès? <pad> PRON AUX VERB ADV PUNCT <pad> nsubj aux:tense ROOT advmod punct <pad> 2 2 1 2 2 <pad> dbr_Cedbr_,SELECT DISTINCT var_uri WHERE bra_open dbr_Cedbr_(dwarf_planet) dbo_discoverer var_uri bra_close 
Who is the king of the Netherlands? <pad> PRON AUX DET NOUN ADP DET PROPN PUNCT <pad> attr ROOT det nsubj prep det pobj punct <pad> 2 1 3 2 3 5 4 2 <pad> res_Netherlands,SELECT DISTINCT var_uri WHERE bra_open res_Netherlands dbo_leader var_uri sep_dot var_uri rdf_type dbo_Royalty bra_close 
Wer ist der König der Niederlande? <pad> PRON AUX DET NOUN DET PROPN PUNCT <pad> sb ROOT nk pd nk ag punct <pad> 2 1 3 2 4 3 2 <pad> res_Netherlands,SELECT DISTINCT var_uri WHERE bra_open res_Netherlands dbo_leader var_uri sep_dot var_uri rdf_type dbo_Royalty bra_close 
Qui est le roi des pays-bas? <pad> PRON AUX DET NOUN ADP NOUN PROPN ADJ PUNCT <pad> nsubj cop det ROOT case nmod nmod nmod punct <pad> 2 2 2 1 3 2 2 2 2 <pad> res_Netherlands,SELECT DISTINCT var_uri WHERE bra_open res_Netherlands dbo_leader var_uri sep_dot var_uri rdf_type dbo_Royalty bra_close 
Is Cola a beverage? <pad> AUX PROPN DET NOUN PUNCT <pad> ROOT nsubj det attr punct <pad> 1 2 3 2 2 <pad> res_Cola,ASK WHERE bra_open res_Cola rdf_type dbo_Beverage bra_close 
Ist ein Getränk? <pad> AUX DET NOUN PUNCT <pad> ROOT nk pd punct <pad> 1 3 2 2 <pad> res_Cola,ASK WHERE bra_open res_Cola rdf_type dbo_Beverage bra_close 
Le Cola est-il une boisson? <pad> DET PROPN AUX PRON DET NOUN PUNCT <pad> det nsubj cop dep det ROOT punct <pad> 3 2 2 3 2 1 2 <pad> res_Cola,ASK WHERE bra_open res_Cola rdf_type dbo_Beverage bra_close 
What is the alma mater of the chancellor of Germany Angela Merkel? <pad> PRON AUX DET NOUN NOUN ADP DET PROPN ADP PROPN PROPN PROPN PUNCT <pad> attr ROOT det compound nsubj prep det nmod prep pobj compound pobj punct <pad> 2 1 3 3 2 3 6 5 6 7 5 4 2 <pad> dbr_Angela_Merkel,SELECT var_Almamater WHERE bra_open dbr_Angela_Merkel dbo_almaMater var_Almamater bra_close 
Welche Universität hat Bundeskanzlerin Angela Merkel absolviert? <pad> DET NOUN AUX NOUN PROPN PROPN VERB PUNCT <pad> nk oa ROOT sb pnc nk oc punct <pad> 4 3 1 2 4 3 2 2 <pad> dbr_Angela_Merkel,SELECT var_Almamater WHERE bra_open dbr_Angela_Merkel dbo_almaMater var_Almamater bra_close 
Quelle Université la chancelière allemande Angela Merkel est-elle diplômée? <pad> ADJ NOUN DET NOUN ADJ PROPN PROPN ADJ VERB PUNCT <pad> det nsubj det dep amod ROOT flat:name amod acl punct <pad> 3 2 4 3 4 1 2 2 2 2 <pad> dbr_Angela_Merkel,SELECT var_Almamater WHERE bra_open dbr_Angela_Merkel dbo_almaMater var_Almamater bra_close 
