question,query
Welche Schauspieler wurden in Deutschland geboren? <pad> DET NOUN AUX ADP PROPN VERB PUNCT <pad> nk sb ROOT mo nk oc punct <pad> 3 2 1 3 4 2 2 <pad> dbr_Germany dbr_Germany,SELECT DISTINCT var_uri WHERE bra_open var_uri a dbo_Actor bra_open var_uri dbo_birthPlace dbr_Germany bra_close UNION bra_open var_uri dbo_birthPlace var_place sep_dot var_place dbo_country dbr_Germany bra_close bra_close 
Quels acteurs sont nés en Allemagne ? <pad> ADJ NOUN AUX VERB ADP PROPN PUNCT <pad> amod nsubj:pass aux:pass ROOT case obl:mod punct <pad> 3 2 2 1 3 2 2 <pad> dbr_Germany dbr_Germany,SELECT DISTINCT var_uri WHERE bra_open var_uri a dbo_Actor bra_open var_uri dbo_birthPlace dbr_Germany bra_close UNION bra_open var_uri dbo_birthPlace var_place sep_dot var_place dbo_country dbr_Germany bra_close bra_close 
How much carbs does peanut butter have? <pad> SCONJ ADJ NOUN AUX VERB NOUN VERB PUNCT <pad> advmod amod nsubj aux compound nsubj ROOT punct <pad> 4 3 3 3 3 2 1 2 <pad> dbr_Peanut_butter,SELECT DISTINCT var_carbs WHERE bra_open dbr_Peanut_butter dbp_carbs var_carbs bra_close 
Wie viele Kohlenhydrate hat Erdnussbutter? <pad> ADV DET NOUN VERB PRON PUNCT <pad> mo nk sb ROOT oa punct <pad> 4 3 2 1 2 2 <pad> dbr_Peanut_butter,SELECT DISTINCT var_carbs WHERE bra_open dbr_Peanut_butter dbp_carbs var_carbs bra_close 
Who produced the most films? <pad> PRON VERB DET ADJ NOUN PUNCT <pad> nsubj ROOT det amod dobj punct <pad> 2 1 3 3 2 2 <pad> ,SELECT DISTINCT var_uri WHERE bra_open var_film rdf_type dbo_Film sep_dot var_film dbo_producer var_uri sep_dot bra_close ORDER BY DESC(COUNT( var_film)) OFFSET 0 LIMIT 1
Wer hat die meisten Filme produziert? <pad> PRON VERB DET DET NOUN VERB PUNCT <pad> sb ROOT nk nk oa oc punct <pad> 2 1 4 4 3 2 2 <pad> ,SELECT DISTINCT var_uri WHERE bra_open var_film rdf_type dbo_Film sep_dot var_film dbo_producer var_uri sep_dot bra_close ORDER BY DESC(COUNT( var_film)) OFFSET 0 LIMIT 1
Qui a produit le plus de films ? <pad> PRON AUX VERB DET ADV ADP NOUN PUNCT <pad> nsubj aux:tense ROOT det obj case nmod punct <pad> 2 2 1 3 2 4 3 2 <pad> ,SELECT DISTINCT var_uri WHERE bra_open var_film rdf_type dbo_Film sep_dot var_film dbo_producer var_uri sep_dot bra_close ORDER BY DESC(COUNT( var_film)) OFFSET 0 LIMIT 1
How many employees does Google have? <pad> SCONJ ADJ NOUN AUX PROPN VERB PUNCT <pad> advmod amod dobj aux nsubj ROOT punct <pad> 4 3 2 2 2 1 2 <pad> dbr_Google,SELECT DISTINCT var_num WHERE bra_open dbr_Google dbo_numberOfEmployees var_num bra_close 
Wie viele Angestellte hat Google? <pad> ADV DET NOUN VERB PROPN PUNCT <pad> mo nk sb ROOT oa punct <pad> 4 3 2 1 2 2 <pad> dbr_Google,SELECT DISTINCT var_num WHERE bra_open dbr_Google dbo_numberOfEmployees var_num bra_close 
Combien d'employés compte Google ? <pad> ADV ADP NOUN NOUN NOUN PUNCT <pad> advmod case ROOT amod nmod punct <pad> 2 2 1 2 2 2 <pad> dbr_Google,SELECT DISTINCT var_num WHERE bra_open dbr_Google dbo_numberOfEmployees var_num bra_close 
Give me all actors who were born in Berlin. <pad> VERB PRON DET NOUN PRON AUX VERB ADP PROPN PUNCT <pad> ROOT dative det dobj nsubjpass auxpass relcl prep pobj punct <pad> 1 2 3 2 4 4 3 4 5 2 <pad> dbr_Berlin,SELECT DISTINCT var_uri WHERE bra_open var_uri a dbo_Actor ; dbo_birthPlace dbr_Berlin bra_close 
"Liste alle Schauspieler auf, die in Berlin geboren wurden. <pad> NOUN DET NOUN ADP PUNCT PRON ADP PROPN VERB AUX PUNCT <pad> ROOT nk oa svp punct sb mo nk oc rc punct <pad> 1 3 2 2 2 3 4 5 3 2 2 <pad> dbr_Berlin",SELECT DISTINCT var_uri WHERE bra_open var_uri a dbo_Actor ; dbo_birthPlace dbr_Berlin bra_close 
Donnez-moi tous les acteurs qui sont nés à Berlin. <pad> PROPN PRON ADJ DET NOUN PRON AUX VERB ADP PROPN PUNCT <pad> ROOT dep amod det nmod nsubj aux:tense acl:relcl case obl:arg punct <pad> 1 2 3 3 2 4 4 3 5 4 2 <pad> dbr_Berlin,SELECT DISTINCT var_uri WHERE bra_open var_uri a dbo_Actor ; dbo_birthPlace dbr_Berlin bra_close 
Who created Goofy? <pad> PRON VERB PROPN PUNCT <pad> nsubj ROOT dobj punct <pad> 2 1 2 2 <pad> dbr_Goofy,SELECT DISTINCT var_uri WHERE bra_open dbr_Goofy dbo_creator var_uri bra_close 
Wer hat Goofy erschaffen? <pad> PRON AUX PROPN VERB PUNCT <pad> sb ROOT oa oc punct <pad> 2 1 3 2 2 <pad> dbr_Goofy,SELECT DISTINCT var_uri WHERE bra_open dbr_Goofy dbo_creator var_uri bra_close 
Qui a créé Goofy ? <pad> PRON AUX VERB PROPN PUNCT <pad> nsubj aux:tense ROOT obj punct <pad> 2 2 1 2 2 <pad> dbr_Goofy,SELECT DISTINCT var_uri WHERE bra_open dbr_Goofy dbo_creator var_uri bra_close 
Which music albums contain the song Last Christmas? <pad> DET NOUN NOUN VERB DET NOUN ADJ PROPN PUNCT <pad> det compound nsubj ROOT det dobj amod npadvmod punct <pad> 3 3 2 1 3 2 3 2 2 <pad> ,"SELECT DISTINCT var_uri WHERE bra_open var_single dbo_album var_uri ; rdfs_label> ""Last Christmas""@en bra_close "
Auf welchen Musikalben befindet sich das Lied Last Christmas? <pad> ADP DET NOUN VERB PRON DET NOUN PROPN PROPN PUNCT <pad> mo nk nk ROOT oa nk sb pnc nk punct <pad> 2 4 3 1 2 3 2 4 3 2 <pad> ,"SELECT DISTINCT var_uri WHERE bra_open var_single dbo_album var_uri ; rdfs_label> ""Last Christmas""@en bra_close "
Quels albums musicaux contiennent la chanson Last Christmas ? <pad> ADJ NOUN ADJ VERB DET NOUN PROPN PROPN PUNCT <pad> amod nsubj amod ROOT det obj appos flat:name punct <pad> 3 2 3 1 3 2 3 4 2 <pad> ,"SELECT DISTINCT var_uri WHERE bra_open var_single dbo_album var_uri ; rdfs_label> ""Last Christmas""@en bra_close "
When was Alberta admitted as province? <pad> SCONJ AUX PROPN VERB ADP NOUN PUNCT <pad> advmod auxpass nsubj ROOT prep pobj punct <pad> 2 2 2 1 2 3 2 <pad> dbr_Alberta,SELECT DISTINCT var_date WHERE bra_open dbr_Alberta dbp_admittancedate var_date bra_close 
Wann wurde Alberta zu einer Provinz? <pad> ADV AUX PROPN ADP DET NOUN PUNCT <pad> mo ROOT sb mo nk nk punct <pad> 2 1 2 2 4 3 2 <pad> dbr_Alberta,SELECT DISTINCT var_date WHERE bra_open dbr_Alberta dbp_admittancedate var_date bra_close 
Quand l'Alberta a-t-elle été admise comme province ? <pad> SCONJ DET PROPN AUX PRON PRON AUX VERB ADP NOUN PUNCT <pad> mark det nsubj:pass aux:tense advmod nsubj:pass aux:pass ROOT case obl:mod punct <pad> 2 3 2 2 2 2 2 1 3 2 2 <pad> dbr_Alberta,SELECT DISTINCT var_date WHERE bra_open dbr_Alberta dbp_admittancedate var_date bra_close 
How many missions does the Soyuz programme have? <pad> SCONJ ADJ NOUN AUX DET PROPN NOUN VERB PUNCT <pad> advmod amod dobj aux det compound nsubj ROOT punct <pad> 4 3 2 2 3 3 2 1 2 <pad> dbr_Soyuz_programme,SELECT (COUNT(DISTINCT var_uri) AS var_c) WHERE bra_open var_uri dbp_programme dbr_Soyuz_programme bra_close 
Wie viele Missionen hat das Soyuz-Programm? <pad> ADV DET NOUN VERB DET NOUN PUNCT <pad> mo nk oa ROOT nk sb punct <pad> 4 3 2 1 3 2 2 <pad> dbr_Soyuz_programme,SELECT (COUNT(DISTINCT var_uri) AS var_c) WHERE bra_open var_uri dbp_programme dbr_Soyuz_programme bra_close 
Combien de missions le programme Soyouz compte-t-il ? <pad> ADV ADP NOUN DET NOUN PROPN ADJ PUNCT <pad> advmod case ROOT det nsubj nmod amod punct <pad> 2 2 1 3 2 3 3 2 <pad> dbr_Soyuz_programme,SELECT (COUNT(DISTINCT var_uri) AS var_c) WHERE bra_open var_uri dbp_programme dbr_Soyuz_programme bra_close 
Give me all the TV shows with Neil Patrick Harris. <pad> VERB PRON DET DET NOUN VERB ADP PROPN PROPN PROPN PUNCT <pad> ROOT dative predet det compound dobj prep compound compound pobj punct <pad> 1 2 3 3 3 2 3 5 5 4 2 <pad> dbr_Neil_Patrick_Harris,SELECT DISTINCT var_uri WHERE bra_open var_uri a dbo_TelevisionShow ; dbo_starring dbr_Neil_Patrick_Harris bra_close 
Gib mir alle Fernsehsendungen mit Neil Patrick Harris. <pad> NOUN PRON DET NOUN ADP NOUN PROPN PROPN PUNCT <pad> ROOT da nk oa mnr nk pnc nk punct <pad> 1 2 3 2 3 4 6 5 2 <pad> dbr_Neil_Patrick_Harris,SELECT DISTINCT var_uri WHERE bra_open var_uri a dbo_TelevisionShow ; dbo_starring dbr_Neil_Patrick_Harris bra_close 
Donne-moi tous les programmes télévisés avec Neil Patrick Harris. <pad> PROPN PRON ADJ DET NOUN VERB ADP PROPN PROPN PROPN PUNCT <pad> ROOT dep amod det nsubj acl case nmod flat:name flat:name punct <pad> 1 2 3 3 2 3 4 3 4 5 2 <pad> dbr_Neil_Patrick_Harris,SELECT DISTINCT var_uri WHERE bra_open var_uri a dbo_TelevisionShow ; dbo_starring dbr_Neil_Patrick_Harris bra_close 
When were the Hells Angels founded? <pad> SCONJ AUX DET PROPN PROPN VERB PUNCT <pad> advmod auxpass det compound nsubj ROOT punct <pad> 3 2 3 3 2 1 2 <pad> dbr_Hells_Angels,SELECT DISTINCT var_date WHERE bra_open dbr_Hells_Angels dbp_founded var_date bra_close 
Wann wurden die Berge der Engel gegründet? <pad> ADV AUX DET NOUN DET NOUN VERB PUNCT <pad> mo ROOT nk sb nk ag oc punct <pad> 3 1 3 2 4 3 2 2 <pad> dbr_Hells_Angels,SELECT DISTINCT var_date WHERE bra_open dbr_Hells_Angels dbp_founded var_date bra_close 
Quand Mont Angeles a été fondée? <pad> SCONJ NOUN PROPN AUX AUX VERB PUNCT <pad> mark nsubj:pass amod aux:tense aux:pass ROOT punct <pad> 3 2 3 2 2 1 2 <pad> dbr_Hells_Angels,SELECT DISTINCT var_date WHERE bra_open dbr_Hells_Angels dbp_founded var_date bra_close 
What is the net income of Apple? <pad> PRON AUX DET ADJ NOUN ADP PROPN PUNCT <pad> attr ROOT det amod nsubj prep pobj punct <pad> 2 1 3 3 2 3 4 2 <pad> dbr_Apple_Inc,SELECT DISTINCT var_ni WHERE bra_open dbr_Apple_Inc sep_dot dbo_netIncome var_ni bra_close 
Was ist Apples Nettoeinkommen? <pad> PRON AUX PROPN NOUN PUNCT <pad> sb ROOT nk pd punct <pad> 2 1 3 2 2 <pad> dbr_Apple_Inc,SELECT DISTINCT var_ni WHERE bra_open dbr_Apple_Inc sep_dot dbo_netIncome var_ni bra_close 
Quel est le revenu net d'une Apple? <pad> ADJ AUX DET NOUN ADJ ADP DET NOUN PUNCT <pad> ROOT dep det nsubj amod case det nmod punct <pad> 1 2 3 2 3 4 4 3 2 <pad> dbr_Apple_Inc,SELECT DISTINCT var_ni WHERE bra_open dbr_Apple_Inc sep_dot dbo_netIncome var_ni bra_close 
Give me all Swedish holidays. <pad> VERB PRON DET ADJ NOUN PUNCT <pad> ROOT dative det amod dobj punct <pad> 1 2 3 3 2 2 <pad> dbr_Sweden,SELECT DISTINCT var_uri WHERE bra_open var_uri a dbo_Holiday ; dbo_country dbr_Sweden bra_close 
Gib mir alle schwedischen Feiertage <pad> NOUN PRON DET ADJ NOUN <pad> ROOT da nk nk oa <pad> 1 2 3 3 2 <pad> dbr_Sweden,SELECT DISTINCT var_uri WHERE bra_open var_uri a dbo_Holiday ; dbo_country dbr_Sweden bra_close 
Donnez-moi toutes les vacances Suédoises <pad> PROPN PRON ADJ DET NOUN ADJ <pad> ROOT dep amod det dep nmod <pad> 1 2 3 3 2 3 <pad> dbr_Sweden,SELECT DISTINCT var_uri WHERE bra_open var_uri a dbo_Holiday ; dbo_country dbr_Sweden bra_close 
In which city was the former Dutch queen Juliana buried? <pad> ADP DET NOUN AUX DET ADJ ADJ NOUN PROPN VERB PUNCT <pad> prep det nsubj ROOT det amod amod attr nsubj relcl punct <pad> 2 3 2 1 3 3 3 2 4 3 2 <pad> dbr_Juliana_of_the_Netherlands,SELECT DISTINCT var_uri WHERE bra_open dbr_Juliana_of_the_Netherlands dbp_burialPlace var_uri sep_dot var_uri a dbo_Settlement bra_close 
In welcher Stadt wurde die ehemalige dänische Königin Julian begraben? <pad> ADP DET NOUN AUX DET ADJ ADJ NOUN PROPN VERB PUNCT <pad> mo nk nk ROOT nk nk nk sb nk oc punct <pad> 3 5 4 1 3 3 3 2 3 2 2 <pad> dbr_Juliana_of_the_Netherlands,SELECT DISTINCT var_uri WHERE bra_open dbr_Juliana_of_the_Netherlands dbp_burialPlace var_uri sep_dot var_uri a dbo_Settlement bra_close 
Dans quelle ville l'ancienne reine du Danemark Juliana a-t-elle été enterrée? <pad> ADP DET NOUN PRON ADJ NOUN ADP PROPN PROPN AUX PRON PRON AUX VERB PUNCT <pad> case det obl:mod punct amod nmod case nmod nmod aux:tense expl:subj nsubj:pass aux:pass ROOT punct <pad> 3 3 2 3 4 3 5 4 5 2 2 2 2 1 2 <pad> dbr_Juliana_of_the_Netherlands,SELECT DISTINCT var_uri WHERE bra_open dbr_Juliana_of_the_Netherlands dbp_burialPlace var_uri sep_dot var_uri a dbo_Settlement bra_close 
List all the musicals with music by Leonard Bernstein. <pad> VERB DET DET NOUN ADP NOUN ADP PROPN PROPN PUNCT <pad> ROOT predet det dobj prep pobj prep compound pobj punct <pad> 1 3 3 2 3 4 5 7 6 2 <pad> dbr_Leonard_Bernstein,SELECT DISTINCT var_uri WHERE bra_open var_uri a dbo_Musical ; dbo_musicBy dbr_Leonard_Bernstein bra_close 
Listen Sie alle Musicals mit Musik von Leonard Bernstein auf. <pad> PRON PRON DET NOUN ADP NOUN ADP PROPN PROPN ADP PUNCT <pad> ROOT sb nk oa mnr nk pg pnc nk svp punct <pad> 1 2 3 2 3 4 5 7 6 2 2 <pad> dbr_Leonard_Bernstein,SELECT DISTINCT var_uri WHERE bra_open var_uri a dbo_Musical ; dbo_musicBy dbr_Leonard_Bernstein bra_close 
Listez toutes les comédies musicales avec la musique de Leonard Bernstein. <pad> DET ADJ DET NOUN ADJ ADP DET NOUN ADP PROPN PROPN PUNCT <pad> ROOT amod det obl:mod amod case det nmod case nmod flat:name punct <pad> 1 3 3 2 3 4 4 3 5 4 5 2 <pad> dbr_Leonard_Bernstein,SELECT DISTINCT var_uri WHERE bra_open var_uri a dbo_Musical ; dbo_musicBy dbr_Leonard_Bernstein bra_close 
Give me all companies in the advertising industry. <pad> VERB PRON DET NOUN ADP DET NOUN NOUN PUNCT <pad> ROOT dative det dobj prep det compound pobj punct <pad> 1 2 3 2 3 5 5 4 2 <pad> dbr_Advertising,"SELECT (COUNT(DISTINCT var_uri) AS var_c) WHERE bra_open var_uri a dbo_Company bra_open var_uri dbo_industry dbr_Advertising bra_close UNION bra_open var_uri dbo_industry var_industry FILTER regex( var_industry, ""advertising"", ""i"") bra_close bra_close "
Gib mir alle Firmen der Werbeindustrie. <pad> NOUN PRON DET NOUN DET NOUN PUNCT <pad> ROOT da nk sb nk ag punct <pad> 1 2 3 2 4 3 2 <pad> dbr_Advertising,"SELECT (COUNT(DISTINCT var_uri) AS var_c) WHERE bra_open var_uri a dbo_Company bra_open var_uri dbo_industry dbr_Advertising bra_close UNION bra_open var_uri dbo_industry var_industry FILTER regex( var_industry, ""advertising"", ""i"") bra_close bra_close "
Donne-moi toutes les entreprises de l'industrie de la publicité. <pad> PROPN PRON ADJ DET NOUN ADP DET NOUN ADP DET NOUN PUNCT <pad> ROOT dep amod det dep case det nmod case det nmod punct <pad> 1 2 3 3 2 4 4 3 5 5 4 2 <pad> dbr_Advertising,"SELECT (COUNT(DISTINCT var_uri) AS var_c) WHERE bra_open var_uri a dbo_Company bra_open var_uri dbo_industry dbr_Advertising bra_close UNION bra_open var_uri dbo_industry var_industry FILTER regex( var_industry, ""advertising"", ""i"") bra_close bra_close "
What is the largest metropolitan area in Washington state? <pad> PRON AUX DET ADJ ADJ NOUN ADP PROPN NOUN PUNCT <pad> attr ROOT det amod amod nsubj prep compound pobj punct <pad> 2 1 3 3 3 2 3 5 4 2 <pad> dbr_Washington_,SELECT DISTINCT var_uri WHERE bra_open dbr_Washington_(state) dbp_largestmetro var_uri bra_close 
Welche Metropole ist die größte im Washington Staat? <pad> DET NOUN AUX DET ADJ ADP PROPN NOUN PUNCT <pad> nk sb ROOT nk nk mnr nk pd punct <pad> 3 2 1 4 3 4 5 2 2 <pad> dbr_Washington_,SELECT DISTINCT var_uri WHERE bra_open dbr_Washington_(state) dbp_largestmetro var_uri bra_close 
Quelle est la plus grande métropole de l'état de Washington? <pad> ADJ AUX DET ADV ADJ NOUN ADP DET NOUN ADP PROPN PUNCT <pad> ROOT dep det advmod amod nsubj case det nmod case nmod punct <pad> 1 2 3 4 3 2 4 4 3 5 4 2 <pad> dbr_Washington_,SELECT DISTINCT var_uri WHERE bra_open dbr_Washington_(state) dbp_largestmetro var_uri bra_close 
Who killed John Lennon? <pad> PRON VERB PROPN PROPN PUNCT <pad> nsubj ROOT compound dobj punct <pad> 2 1 3 2 2 <pad> dbr_Death_of_John_Lennon,SELECT DISTINCT var_uri WHERE bra_open var_uri a dbo_Person ; dbp_conviction dbr_Death_of_John_Lennon bra_close 
Wer hat John Lennon getötet? <pad> PRON AUX PROPN PROPN VERB PUNCT <pad> sb ROOT pnc oa oc punct <pad> 2 1 4 3 2 2 <pad> dbr_Death_of_John_Lennon,SELECT DISTINCT var_uri WHERE bra_open var_uri a dbo_Person ; dbp_conviction dbr_Death_of_John_Lennon bra_close 
Qui a tué John Lennon? <pad> PRON AUX VERB PROPN PROPN PUNCT <pad> nsubj aux:tense ROOT obj flat:name punct <pad> 2 2 1 2 3 2 <pad> dbr_Death_of_John_Lennon,SELECT DISTINCT var_uri WHERE bra_open var_uri a dbo_Person ; dbp_conviction dbr_Death_of_John_Lennon bra_close 
Which writers studied in Istanbul? <pad> DET NOUN VERB ADP PROPN PUNCT <pad> det nsubj ROOT prep pobj punct <pad> 3 2 1 2 3 2 <pad> dbr_Istanbul dbr_Istanbul,SELECT DISTINCT var_uri WHERE bra_open var_uri a dbo_Writer bra_open var_uri dbo_almaMater var_x bra_close UNION bra_open var_uri dbo_education var_x bra_close bra_open var_x dbo_city dbr_Istanbul bra_close UNION bra_open var_x dbp_city dbr_Istanbul bra_close bra_close 
Welche Schriftsteller haben in Istanbul studiert ? <pad> DET NOUN AUX ADP PROPN VERB PUNCT <pad> nk sb ROOT mo nk oc punct <pad> 3 2 1 3 4 2 2 <pad> dbr_Istanbul dbr_Istanbul,SELECT DISTINCT var_uri WHERE bra_open var_uri a dbo_Writer bra_open var_uri dbo_almaMater var_x bra_close UNION bra_open var_uri dbo_education var_x bra_close bra_open var_x dbo_city dbr_Istanbul bra_close UNION bra_open var_x dbp_city dbr_Istanbul bra_close bra_close 
Quels écrivains ont étudié à Istanbul? <pad> ADJ NOUN AUX VERB ADP PROPN PUNCT <pad> amod nsubj aux:tense ROOT case obl:mod punct <pad> 3 2 2 1 3 2 2 <pad> dbr_Istanbul dbr_Istanbul,SELECT DISTINCT var_uri WHERE bra_open var_uri a dbo_Writer bra_open var_uri dbo_almaMater var_x bra_close UNION bra_open var_uri dbo_education var_x bra_close bra_open var_x dbo_city dbr_Istanbul bra_close UNION bra_open var_x dbp_city dbr_Istanbul bra_close bra_close 
Give me all Australian metalcore bands. <pad> VERB PRON DET ADJ NOUN NOUN PUNCT <pad> ROOT dative det amod compound dobj punct <pad> 1 2 3 3 3 2 2 <pad> dbr_Metalcore dbr_Australia dbr_Australia,SELECT DISTINCT var_uri WHERE bra_open var_uri a dbo_Band ; dbo_genre dbr_Metalcore bra_open var_uri dbo_hometown dbr_Australia bra_close UNION bra_open var_uri dbo_hometown var_h sep_dot var_h dbo_country dbr_Australia bra_close bra_close 
Gib mir alle australischen metalcore-Bands. <pad> NOUN PRON DET ADJ NOUN PUNCT <pad> ROOT da nk nk oa punct <pad> 1 2 3 3 2 2 <pad> dbr_Metalcore dbr_Australia dbr_Australia,SELECT DISTINCT var_uri WHERE bra_open var_uri a dbo_Band ; dbo_genre dbr_Metalcore bra_open var_uri dbo_hometown dbr_Australia bra_close UNION bra_open var_uri dbo_hometown var_h sep_dot var_h dbo_country dbr_Australia bra_close bra_close 
Donnez-moi tous les groupes de metalcore australiens. <pad> PROPN PRON ADJ DET NOUN ADP NOUN ADJ PUNCT <pad> ROOT dep amod det ROOT case nmod amod punct <pad> 1 2 -1 -1 -1 -1 -1 -1 -1 <pad> dbr_Metalcore dbr_Australia dbr_Australia,SELECT DISTINCT var_uri WHERE bra_open var_uri a dbo_Band ; dbo_genre dbr_Metalcore bra_open var_uri dbo_hometown dbr_Australia bra_close UNION bra_open var_uri dbo_hometown var_h sep_dot var_h dbo_country dbr_Australia bra_close bra_close 
Which countries adopted the Euro? <pad> DET NOUN VERB DET PROPN PUNCT <pad> det nsubj ROOT det dobj punct <pad> 3 2 1 3 2 2 <pad> dbr_Euro,"SELECT DISTINCT var_uri WHERE bra_open var_uri a dbo_Country bra_open var_uri dbo_currency dbr_Euro bra_close UNION bra_open var_uri dbp_currencyCode ""EUR""@en bra_close bra_close "
Welche Länder haben den Euro eingeführt? <pad> DET NOUN AUX DET NOUN VERB PUNCT <pad> nk sb ROOT nk oa oc punct <pad> 3 2 1 4 3 2 2 <pad> dbr_Euro,"SELECT DISTINCT var_uri WHERE bra_open var_uri a dbo_Country bra_open var_uri dbo_currency dbr_Euro bra_close UNION bra_open var_uri dbp_currencyCode ""EUR""@en bra_close bra_close "
Quels pays ont adopté l'Euro ? <pad> ADJ NOUN AUX VERB DET PROPN PUNCT <pad> amod nsubj aux:tense ROOT det obj punct <pad> 3 2 2 1 3 2 2 <pad> dbr_Euro,"SELECT DISTINCT var_uri WHERE bra_open var_uri a dbo_Country bra_open var_uri dbo_currency dbr_Euro bra_close UNION bra_open var_uri dbp_currencyCode ""EUR""@en bra_close bra_close "
Give me all types of eating disorders. <pad> VERB PRON DET NOUN ADP VERB NOUN PUNCT <pad> ROOT dative det dobj prep pcomp dobj punct <pad> 1 2 3 2 3 4 5 2 <pad> ,SELECT DISTINCT var_uri WHERE bra_open var_uri a yago_WikicatEatingDisorders bra_close 
Gib mir alle Arten von Essstörungen. <pad> NOUN PRON DET NOUN ADP NOUN PUNCT <pad> ROOT da nk oa pg nk punct <pad> 1 2 3 2 3 4 2 <pad> ,SELECT DISTINCT var_uri WHERE bra_open var_uri a yago_WikicatEatingDisorders bra_close 
Donnez-moi tous les types de troubles alimentaires. <pad> PROPN PRON ADJ DET NOUN ADP NOUN ADJ PUNCT <pad> ROOT dep amod det ROOT case nmod amod punct <pad> 1 2 -1 -1 -1 -1 -1 -1 -1 <pad> ,SELECT DISTINCT var_uri WHERE bra_open var_uri a yago_WikicatEatingDisorders bra_close 
Was Marc Chagall a jew? <pad> AUX PROPN VERB DET NOUN PUNCT <pad> ROOT nsubj nsubj det dobj punct <pad> 1 3 2 4 3 2 <pad> dbr_Marc_Chagall,"ASK WHERE bra_open dbr_Marc_Chagall dbp_ethnicity ""Jewish""@en bra_close "
War Marc Chagall Jude? <pad> AUX PROPN PROPN PROPN PUNCT <pad> ROOT pnc pnc sb punct <pad> 1 3 3 2 2 <pad> dbr_Marc_Chagall,"ASK WHERE bra_open dbr_Marc_Chagall dbp_ethnicity ""Jewish""@en bra_close "
Marc Chagall était-il juif ? <pad> PROPN PROPN AUX PRON PROPN PUNCT <pad> nsubj:pass flat:name cop expl:subj ROOT punct <pad> 2 3 2 2 1 2 <pad> dbr_Marc_Chagall,"ASK WHERE bra_open dbr_Marc_Chagall dbp_ethnicity ""Jewish""@en bra_close "
What was Brazil's lowest rank in the FIFA World Ranking? <pad> PRON AUX PROPN PART ADJ NOUN ADP DET PROPN PROPN PROPN PUNCT <pad> attr ROOT poss case amod nsubj prep det compound compound pobj punct <pad> 2 1 3 4 3 2 3 5 5 5 4 2 <pad> dbr_Brazil_national_football_team,SELECT DISTINCT var_n WHERE bra_open dbr_Brazil_national_football_team dbp_fifaMin var_n bra_close 
Was ist Brasiliens niedrigster Rang in der FIFA Weltrangliste? <pad> PRON AUX PROPN ADJ NOUN ADP DET NOUN PROPN PUNCT <pad> sb ROOT ag nk pd mnr nk nk nk punct <pad> 2 1 3 3 2 3 5 4 5 2 <pad> dbr_Brazil_national_football_team,SELECT DISTINCT var_n WHERE bra_open dbr_Brazil_national_football_team dbp_fifaMin var_n bra_close 
Quel a été le rang le plus bas du Brésil au classement mondial de la FIFA ? <pad> ADJ AUX AUX DET NOUN DET ADV ADJ ADP NOUN ADP NOUN ADJ ADP DET PROPN PUNCT <pad> obj aux:tense cop det ROOT det advmod amod case nmod case nmod amod case det nmod punct <pad> 2 2 2 2 1 3 3 2 4 3 3 2 3 4 4 3 2 <pad> dbr_Brazil_national_football_team,SELECT DISTINCT var_n WHERE bra_open dbr_Brazil_national_football_team dbp_fifaMin var_n bra_close 
How many films did Leonardo DiCaprio star in? <pad> SCONJ ADJ NOUN VERB PROPN PROPN NOUN ADP PUNCT <pad> advmod amod nsubj ROOT compound compound nsubj prep punct <pad> 4 3 2 1 4 3 2 3 2 <pad> dbr_Leonardo_DiCaprio,SELECT (COUNT(DISTINCT var_uri) AS var_c) WHERE bra_open var_uri a dbo_Film ; dbo_starring dbr_Leonardo_DiCaprio bra_close 
In wie vielen Filmen hat Leonardo DiCaprio gespielt? <pad> ADP CCONJ DET NOUN AUX PROPN PROPN VERB PUNCT <pad> mo cd cj nk ROOT pnc sb oc punct <pad> 3 4 5 4 1 3 2 2 2 <pad> dbr_Leonardo_DiCaprio,SELECT (COUNT(DISTINCT var_uri) AS var_c) WHERE bra_open var_uri a dbo_Film ; dbo_starring dbr_Leonardo_DiCaprio bra_close 
Dans combien de films Leonardo DiCaprio est la star ? <pad> ADP ADV ADP NOUN PROPN PROPN AUX DET NOUN PUNCT <pad> case obl:mod case nmod nmod flat:name cop det ROOT punct <pad> 3 2 4 3 4 5 2 2 1 2 <pad> dbr_Leonardo_DiCaprio,SELECT (COUNT(DISTINCT var_uri) AS var_c) WHERE bra_open var_uri a dbo_Film ; dbo_starring dbr_Leonardo_DiCaprio bra_close 
Was Margaret Thatcher a chemist? <pad> AUX PROPN PROPN DET NOUN PUNCT <pad> ROOT compound nsubj det appos punct <pad> 1 3 2 4 3 2 <pad> dbr_Margaret_Thatcher dbr_Chemist,ASK WHERE bra_open dbr_Margaret_Thatcher dbo_profession dbr_Chemist bra_close 
War Magret Thatcher eine Chemikerin? <pad> AUX PROPN PROPN DET NOUN PUNCT <pad> ROOT pnc sb nk pd punct <pad> 1 3 2 3 2 2 <pad> dbr_Margaret_Thatcher dbr_Chemist,ASK WHERE bra_open dbr_Margaret_Thatcher dbo_profession dbr_Chemist bra_close 
Margaret Thatcher était-elle chimiste ? <pad> NOUN PROPN AUX DET ADJ PUNCT <pad> nsubj flat:name cop det ROOT punct <pad> 2 3 2 2 1 2 <pad> dbr_Margaret_Thatcher dbr_Chemist,ASK WHERE bra_open dbr_Margaret_Thatcher dbo_profession dbr_Chemist bra_close 
Which U.S. states are in the same time zone as Utah? <pad> PRON PROPN NOUN AUX ADP DET ADJ NOUN NOUN ADP PROPN PUNCT <pad> attr compound nsubj ROOT prep det amod compound pobj prep pobj punct <pad> 2 3 2 1 2 4 4 4 3 4 5 2 <pad> dbr_Utah dbr_Utah,SELECT DISTINCT var_uri WHERE bra_open dbr_Utah dbp_timezone var_x sep_dot var_uri a yago_WikicatStatesOfTheUnitedStates ; dbp_timezone var_x FILTER ( var_uri != dbr_Utah ) bra_close 
Welche US Bundesstaaten haben die gleiche Zeitzone wie Utah? <pad> DET PROPN NOUN AUX DET ADJ NOUN ADP NOUN PUNCT <pad> nk nk oa ROOT nk nk sb cm cc punct <pad> 4 3 2 1 3 3 2 4 3 2 <pad> dbr_Utah dbr_Utah,SELECT DISTINCT var_uri WHERE bra_open dbr_Utah dbp_timezone var_x sep_dot var_uri a yago_WikicatStatesOfTheUnitedStates ; dbp_timezone var_x FILTER ( var_uri != dbr_Utah ) bra_close 
Give me all books written by Danielle Steel. <pad> VERB PRON DET NOUN VERB ADP PROPN PROPN PUNCT <pad> ROOT dative det dobj acl agent compound pobj punct <pad> 1 2 3 2 3 4 6 5 2 <pad> dbr_Danielle_Steel,SELECT DISTINCT var_uri WHERE bra_open var_uri a dbo_Book ; dbo_author dbr_Danielle_Steel bra_close 
Gib mir alle Bücher die Danielle Steel geschrieben hat. <pad> NOUN PRON DET NOUN DET PROPN PROPN VERB AUX PUNCT <pad> oa da nk sb nk pnc oa oc ROOT punct <pad> 3 3 3 2 4 4 3 2 1 2 <pad> dbr_Danielle_Steel,SELECT DISTINCT var_uri WHERE bra_open var_uri a dbo_Book ; dbo_author dbr_Danielle_Steel bra_close 
Which country has the most official languages? <pad> DET NOUN VERB DET ADJ ADJ NOUN PUNCT <pad> det nsubj ROOT det advmod amod dobj punct <pad> 3 2 1 3 4 3 2 2 <pad> ,SELECT DISTINCT var_uri WHERE bra_open var_uri rdf_type dbo_Country sep_dot var_uri dbp_officialLanguages var_language sep_dot bra_close ORDER BY DESC(COUNT( var_language)) OFFSET 0 LIMIT 1
Welches Land gibt es die meisten Amtssprachen? <pad> DET NOUN VERB PRON DET DET NOUN PUNCT <pad> nk oa ROOT ep nk nk oa punct <pad> 3 2 1 2 3 3 2 2 <pad> ,SELECT DISTINCT var_uri WHERE bra_open var_uri rdf_type dbo_Country sep_dot var_uri dbp_officialLanguages var_language sep_dot bra_close ORDER BY DESC(COUNT( var_language)) OFFSET 0 LIMIT 1
