question,query
Dans quel ancien empire pouvait-on payer avec des fèves de cacao ? <pad> ADP DET ADJ NOUN VERB PRON VERB ADP DET NOUN ADP NOUN PUNCT <pad> case det amod obl:mod ROOT nsubj xcomp case det obl:arg case nmod punct <pad> 3 3 3 2 1 2 2 4 4 3 5 4 2 <pad> res_Cocoa_bean,SELECT DISTINCT var_uri WHERE bra_open var_uri dbo_currency res_Cocoa_bean bra_close 
How many theories did Albert Einstein come up with? <pad> SCONJ ADJ NOUN AUX PROPN PROPN VERB ADP ADP PUNCT <pad> advmod amod nsubj aux compound nsubj ROOT prt prep punct <pad> 5 4 3 2 3 2 1 2 2 2 <pad> dbr_Albert_Einstein,SELECT (COUNT( var_uri) AS var_count) WHERE bra_open dbr_Albert_Einstein dbo_knownFor var_uri bra_close 
Wie viele Theorien hat Albert Einstein entwickelt? <pad> ADV DET NOUN AUX PROPN PROPN VERB PUNCT <pad> cm nk mo ROOT pnc oa oc punct <pad> 4 4 3 1 4 3 2 2 <pad> dbr_Albert_Einstein,SELECT (COUNT( var_uri) AS var_count) WHERE bra_open dbr_Albert_Einstein dbo_knownFor var_uri bra_close 
Combien de théories Albert Einstein a-t-il produit ? <pad> ADV ADP NOUN PROPN PROPN AUX PRON PRON VERB PUNCT <pad> advmod case advcl nsubj flat:name aux:tense expl:subj expl:subj ROOT punct <pad> 3 3 2 2 3 2 2 2 1 2 <pad> dbr_Albert_Einstein,SELECT (COUNT( var_uri) AS var_count) WHERE bra_open dbr_Albert_Einstein dbo_knownFor var_uri bra_close 
Who composed the soundtrack for Cameron's Titanic? <pad> PRON VERB DET NOUN ADP PROPN PART PROPN PUNCT <pad> nsubj ROOT det dobj prep poss case pobj punct <pad> 2 1 3 2 3 5 6 4 2 <pad> dbr_Titanic_,SELECT DISTINCT var_uri WHERE bra_open dbr_Titanic_(1997_film) dbo_musicComposer var_uri bra_close 
Wer hat den Titeltrack zu Titanic von Cameron komponiert? <pad> PRON AUX DET NOUN ADP PROPN ADP PROPN VERB PUNCT <pad> sb ROOT nk oa mnr nk pg nk oc punct <pad> 2 1 4 3 4 5 6 7 2 2 <pad> dbr_Titanic_,SELECT DISTINCT var_uri WHERE bra_open dbr_Titanic_(1997_film) dbo_musicComposer var_uri bra_close 
Qui a composé la bande originale du Titanic de Cameron ? <pad> PRON AUX VERB DET ADJ ADJ ADP PROPN ADP NOUN PUNCT <pad> nsubj aux:tense ROOT det amod obj case obl:arg case nmod punct <pad> 2 2 1 3 3 2 3 2 4 3 2 <pad> dbr_Titanic_,SELECT DISTINCT var_uri WHERE bra_open dbr_Titanic_(1997_film) dbo_musicComposer var_uri bra_close 
Give me the runtime of Toy Story. <pad> VERB PRON DET NOUN ADP PROPN PROPN PUNCT <pad> ROOT dative det dobj prep compound pobj punct <pad> 1 2 3 2 3 5 4 2 <pad> res_Toy_Story,SELECT DISTINCT var_runtime WHERE bra_open res_Toy_Story dbo_runtime var_runtime bra_close 
Gib mir die Länge von Toy Story. <pad> NOUN PRON DET NOUN ADP PROPN PROPN PUNCT <pad> ROOT da nk sb pg pnc nk punct <pad> 1 2 3 2 3 5 4 2 <pad> res_Toy_Story,SELECT DISTINCT var_runtime WHERE bra_open res_Toy_Story dbo_runtime var_runtime bra_close 
Donnez-moi le temps de visualisation de Toy Story. <pad> PROPN PRON DET NOUN ADP NOUN ADP PROPN PROPN PUNCT <pad> ROOT dep det nsubj case nmod case nmod flat:name punct <pad> 1 2 3 2 4 3 5 4 5 2 <pad> res_Toy_Story,SELECT DISTINCT var_runtime WHERE bra_open res_Toy_Story dbo_runtime var_runtime bra_close 
With how many countries Iran has borders? <pad> ADP SCONJ ADJ NOUN PROPN AUX NOUN PUNCT <pad> ROOT advmod amod dative nsubj pcomp dobj punct <pad> 1 5 4 3 3 2 3 3 <pad> dbr_Geography_of_Iran,SELECT var_border WHERE bra_open dbr_Geography_of_Iran dbp_borders var_border bra_close LIMIT 8
An wie viele Länder grenzt der Iran? <pad> ADP ADV DET NOUN VERB DET PROPN PUNCT <pad> mo mo nk nk ROOT nk sb punct <pad> 2 5 4 3 1 3 2 2 <pad> dbr_Geography_of_Iran,SELECT var_border WHERE bra_open dbr_Geography_of_Iran dbp_borders var_border bra_close LIMIT 8
Avec combien de pays l'Iran a-t-il des frontières ? <pad> ADP ADV ADP NOUN DET PROPN AUX PRON PRON ADP NOUN PUNCT <pad> case advmod case nmod det nsubj aux:tense cop dep case ROOT punct <pad> 3 2 4 3 3 2 2 2 3 2 1 2 <pad> dbr_Geography_of_Iran,SELECT var_border WHERE bra_open dbr_Geography_of_Iran dbp_borders var_border bra_close LIMIT 8
Which electronics companies were founded in Beijing? <pad> DET NOUN NOUN AUX VERB ADP PROPN PUNCT <pad> det compound nsubjpass auxpass ROOT prep pobj punct <pad> 3 3 2 2 1 2 3 2 <pad> res_Electronics res_Beijing,SELECT DISTINCT var_uri WHERE bra_open var_uri rdf_type dbo_Company ; dbo_industry res_Electronics ; dbo_foundationPlace res_Beijing bra_close 
Welche Elektronikhersteller wurden in Beijing gegründet? <pad> DET NOUN AUX ADP PROPN VERB PUNCT <pad> nk sb ROOT mo nk oc punct <pad> 3 2 1 3 4 2 2 <pad> res_Electronics res_Beijing,SELECT DISTINCT var_uri WHERE bra_open var_uri rdf_type dbo_Company ; dbo_industry res_Electronics ; dbo_foundationPlace res_Beijing bra_close 
Quelles entreprises d'électronique ont été fondées à Pékin ? <pad> DET NOUN ADP NOUN AUX AUX VERB ADP PROPN PUNCT <pad> det nsubj:pass case nmod aux:tense aux:pass ROOT case obl:arg punct <pad> 3 2 4 3 2 2 1 3 2 2 <pad> res_Electronics res_Beijing,SELECT DISTINCT var_uri WHERE bra_open var_uri rdf_type dbo_Company ; dbo_industry res_Electronics ; dbo_foundationPlace res_Beijing bra_close 
Who was the successor of John F. Kennedy? <pad> PRON AUX DET NOUN ADP PROPN PROPN PROPN PUNCT <pad> attr ROOT det nsubj prep compound compound pobj punct <pad> 2 1 3 2 3 5 5 4 2 <pad> res_John_F,SELECT DISTINCT var_uri WHERE bra_open res_John_F sep_dot _Kennedy dbo_successor var_uri bra_close 
Wer war der Nachfolger von John F. Kennedy? <pad> PRON AUX DET NOUN ADP PROPN PROPN PROPN PUNCT <pad> sb ROOT nk pd pg pnc pnc nk punct <pad> 2 1 3 2 3 5 5 4 2 <pad> res_John_F,SELECT DISTINCT var_uri WHERE bra_open res_John_F sep_dot _Kennedy dbo_successor var_uri bra_close 
Qui était le successeur de John F. Kennedy ? <pad> PRON AUX DET NOUN ADP PROPN PROPN PROPN PUNCT <pad> nsubj cop det ROOT case nmod appos flat:name punct <pad> 2 2 2 1 3 2 2 3 2 <pad> res_John_F,SELECT DISTINCT var_uri WHERE bra_open res_John_F sep_dot _Kennedy dbo_successor var_uri bra_close 
Who is the mayor of Paris? <pad> PRON AUX DET NOUN ADP PROPN PUNCT <pad> attr ROOT det nsubj prep pobj punct <pad> 2 1 3 2 3 4 2 <pad> res_Paris,SELECT DISTINCT var_uri WHERE bra_open res_Paris dbo_mayor var_uri bra_close 
Wer ist der Bürgermeister von Paris? <pad> PRON AUX DET NOUN ADP PROPN PUNCT <pad> sb ROOT nk pd pg nk punct <pad> 2 1 3 2 3 4 2 <pad> res_Paris,SELECT DISTINCT var_uri WHERE bra_open res_Paris dbo_mayor var_uri bra_close 
Qui est le maire de Paris ? <pad> PRON AUX DET NOUN ADP PROPN PUNCT <pad> nsubj cop det ROOT case nmod punct <pad> 2 2 2 1 3 2 2 <pad> res_Paris,SELECT DISTINCT var_uri WHERE bra_open res_Paris dbo_mayor var_uri bra_close 
Did Arnold Schwarzenegger attend a university? <pad> AUX PROPN PROPN VERB DET NOUN PUNCT <pad> aux compound nsubj ROOT det dobj punct <pad> 2 3 2 1 3 2 2 <pad> res_Arnold_Schwarzenegger,ASK WHERE bra_open res_Arnold_Schwarzenegger dbo_almaMater var_x sep_dot var_x rdf_type dbo_University bra_close 
War Arnold Schwarzenegger an einer Universität eingeschrieben? <pad> AUX PROPN PROPN ADP DET NOUN VERB PUNCT <pad> ROOT pnc sb mo nk nk oc punct <pad> 1 3 2 3 5 4 2 2 <pad> res_Arnold_Schwarzenegger,ASK WHERE bra_open res_Arnold_Schwarzenegger dbo_almaMater var_x sep_dot var_x rdf_type dbo_University bra_close 
Arnold Schwarzenegger est-il allé en université ? <pad> PROPN PROPN AUX PRON VERB ADP NOUN PUNCT <pad> nsubj:pass flat:name aux:pass dep ROOT case obl:arg punct <pad> 2 3 2 3 1 3 2 2 <pad> res_Arnold_Schwarzenegger,ASK WHERE bra_open res_Arnold_Schwarzenegger dbo_almaMater var_x sep_dot var_x rdf_type dbo_University bra_close 
Is James Bond married? <pad> AUX PROPN PROPN VERB PUNCT <pad> auxpass compound nsubj ROOT punct <pad> 2 3 2 1 2 <pad> res_James_Bond,ASK WHERE bra_open res_James_Bond dbo_spouse var_uri bra_close 
Ist James Bond verheiratet? <pad> AUX PROPN PROPN VERB PUNCT <pad> ROOT pnc sb pd punct <pad> 1 3 2 2 2 <pad> res_James_Bond,ASK WHERE bra_open res_James_Bond dbo_spouse var_uri bra_close 
James Bond est-il marié ? <pad> PROPN PROPN AUX PRON ADJ PUNCT <pad> nsubj flat:name cop expl:subj ROOT punct <pad> 2 3 2 2 1 2 <pad> res_James_Bond,ASK WHERE bra_open res_James_Bond dbo_spouse var_uri bra_close 
Does the Isar flow into a lake? <pad> AUX DET PROPN NOUN ADP DET NOUN PUNCT <pad> aux det compound ROOT prep det pobj punct <pad> 2 2 2 1 2 4 3 2 <pad> res_Isar,ASK WHERE bra_open var_x dbo_inflow res_Isar ; rdf_type dbo_Lake bra_close 
Fließt die Isar in einen See? <pad> VERB DET PROPN ADP DET NOUN PUNCT <pad> ROOT nk sb mo nk nk punct <pad> 1 3 2 2 4 3 2 <pad> res_Isar,ASK WHERE bra_open var_x dbo_inflow res_Isar ; rdf_type dbo_Lake bra_close 
L'Isar se jette-t-il dans un lac ? <pad> DET PROPN PRON X PRON PRON ADP DET PROPN PUNCT <pad> det nsubj expl:comp ROOT dep advmod case det obl:arg punct <pad> 3 2 2 1 2 2 3 3 2 2 <pad> res_Isar,ASK WHERE bra_open var_x dbo_inflow res_Isar ; rdf_type dbo_Lake bra_close 
Which Indian company has the most employees? <pad> DET ADJ NOUN VERB DET ADJ NOUN PUNCT <pad> det amod nsubj ROOT det amod dobj punct <pad> 3 3 2 1 3 3 2 2 <pad> res_India,SELECT DISTINCT var_uri WHERE bra_open var_uri rdf_type dbo_Company ; dbo_location res_India ; dbo_numberOfEmployees var_n bra_close ORDER BY DESC( var_n) OFFSET 0 LIMIT 1
Welches indische Unternehmen hat die meisten Mitarbeiter? <pad> DET ADJ NOUN AUX DET DET NOUN PUNCT <pad> nk nk sb ROOT nk nk oa punct <pad> 3 3 2 1 3 3 2 2 <pad> res_India,SELECT DISTINCT var_uri WHERE bra_open var_uri rdf_type dbo_Company ; dbo_location res_India ; dbo_numberOfEmployees var_n bra_close ORDER BY DESC( var_n) OFFSET 0 LIMIT 1
Quelle entreprise indienne a le plus d'employés ? <pad> ADJ NOUN ADJ VERB DET ADV ADP NOUN PUNCT <pad> det nsubj amod ROOT det obj case obl:arg punct <pad> 3 2 3 1 3 2 3 2 2 <pad> res_India,SELECT DISTINCT var_uri WHERE bra_open var_uri rdf_type dbo_Company ; dbo_location res_India ; dbo_numberOfEmployees var_n bra_close ORDER BY DESC( var_n) OFFSET 0 LIMIT 1
Who was John F. Kennedy's vice president? <pad> PRON AUX PROPN PROPN PROPN PART NOUN NOUN PUNCT <pad> attr ROOT compound compound poss case compound nsubj punct <pad> 2 1 4 4 3 4 3 2 2 <pad> res_John_F,SELECT DISTINCT var_uri WHERE bra_open res_John_F sep_dot _Kennedy dbo_vicePresident var_uri bra_close 
Wer war Vizepräsident unter John F. Kennedy? <pad> PRON AUX NOUN ADP PROPN PROPN PROPN PUNCT <pad> sb ROOT pd mnr pnc pnc nk punct <pad> 2 1 2 3 5 5 4 2 <pad> res_John_F,SELECT DISTINCT var_uri WHERE bra_open res_John_F sep_dot _Kennedy dbo_vicePresident var_uri bra_close 
Which country does the creator of Miffy come from? <pad> DET NOUN AUX DET NOUN ADP PROPN VERB ADP PUNCT <pad> det nsubj aux det nsubj prep pobj ROOT prep punct <pad> 4 3 2 3 2 3 4 1 2 2 <pad> res_Miffy,SELECT DISTINCT var_uri WHERE bra_open res_Miffy dbo_creator var_x sep_dot var_x dbo_nationality var_uri bra_close 
Aus welchem Land kommt der Erfinder von Miffy? <pad> ADP DET NOUN VERB DET NOUN ADP PROPN PUNCT <pad> mo nk nk ROOT nk sb pg nk punct <pad> 2 4 3 1 3 2 3 4 2 <pad> res_Miffy,SELECT DISTINCT var_uri WHERE bra_open res_Miffy dbo_creator var_x sep_dot var_x dbo_nationality var_uri bra_close 
In what city is the Heineken brewery? <pad> ADP PRON NOUN AUX DET PROPN NOUN PUNCT <pad> prep det nsubj ROOT det compound nsubj punct <pad> 2 3 2 1 3 3 2 2 <pad> res_Heineken,SELECT DISTINCT var_uri WHERE bra_open res_Heineken dbo_manufacturer var_x sep_dot var_x dbo_locationCity var_uri bra_close 
Wo hat die Heineken Brauerei ihren Sitz? <pad> ADV VERB DET NOUN NOUN DET NOUN PUNCT <pad> mo ROOT nk sb oa nk oa punct <pad> 2 1 3 2 2 3 2 2 <pad> res_Heineken,SELECT DISTINCT var_uri WHERE bra_open res_Heineken dbo_manufacturer var_x sep_dot var_x dbo_locationCity var_uri bra_close 
Is Barack Obama a democrat? <pad> AUX PROPN PROPN DET NOUN PUNCT <pad> ROOT compound nsubj det attr punct <pad> 1 3 2 3 2 2 <pad> res_Barack_Obama dbr_Democratic_Party_,ASK WHERE bra_open res_Barack_Obama dbo_party dbr_Democratic_Party_(United_States) bra_close 
Ist Barack Obama Demokrat? <pad> AUX NOUN PROPN PROPN PUNCT <pad> ROOT sb pnc nk punct <pad> 1 2 4 3 2 <pad> res_Barack_Obama dbr_Democratic_Party_,ASK WHERE bra_open res_Barack_Obama dbo_party dbr_Democratic_Party_(United_States) bra_close 
List the children of Margaret Thatcher. <pad> VERB DET NOUN ADP PROPN PROPN PUNCT <pad> ROOT det dobj prep compound pobj punct <pad> 1 3 2 3 5 4 2 <pad> res_Margaret_Thatcher,SELECT DISTINCT var_uri WHERE bra_open res_Margaret_Thatcher dbo_child var_uri bra_close 
Wie heißen die Kinder von Margaret Thatcher? <pad> ADV VERB DET NOUN ADP PROPN PROPN PUNCT <pad> mo ROOT nk sb pg pnc nk punct <pad> 2 1 3 2 3 5 4 2 <pad> res_Margaret_Thatcher,SELECT DISTINCT var_uri WHERE bra_open res_Margaret_Thatcher dbo_child var_uri bra_close 
From which region is the Melon de Bourgogne? <pad> ADP DET NOUN AUX DET PROPN ADP PROPN PUNCT <pad> prep det nsubj ROOT det nmod nmod attr punct <pad> 2 3 2 1 3 3 3 2 2 <pad> res_Melon_de_Bourgogne,SELECT DISTINCT var_uri WHERE bra_open res_Melon_de_Bourgogne dbo_wineRegion var_uri bra_close 
Aus welcher Region stammt die Melon de Bourgogne? <pad> ADP DET NOUN VERB DET PROPN PROPN PROPN PUNCT <pad> mo nk nk ROOT nk sb pnc nk punct <pad> 2 4 3 1 3 2 4 3 2 <pad> res_Melon_de_Bourgogne,SELECT DISTINCT var_uri WHERE bra_open res_Melon_de_Bourgogne dbo_wineRegion var_uri bra_close 
how big is the total area of North Rhine- Westphalia? <pad> SCONJ ADJ AUX DET ADJ NOUN ADP PROPN PROPN PROPN PUNCT <pad> advmod acomp ROOT det amod nsubj prep compound compound pobj punct <pad> 3 2 1 3 3 2 3 6 5 4 2 <pad> dbr_North_Rhine,SELECT var_tarea WHERE bra_open dbr_North_Rhine-Westphalia dbo_areaTotal var_tarea bra_close 
Wie groß ist die Fläche von Nordrhein Westpfalen? <pad> ADV ADV AUX DET NOUN ADP NOUN NOUN PUNCT <pad> mo pd ROOT nk sb pg nk pd punct <pad> 3 2 1 3 2 3 4 2 2 <pad> dbr_North_Rhine,SELECT var_tarea WHERE bra_open dbr_North_Rhine-Westphalia dbo_areaTotal var_tarea bra_close 
Which city has the most inhabitants? <pad> DET NOUN VERB DET ADJ NOUN PUNCT <pad> det nsubj ROOT det amod dobj punct <pad> 3 2 1 3 3 2 2 <pad> ,SELECT DISTINCT var_uri WHERE bra_open var_uri rdf_type dbo_City ; dbo_populationTotal var_pop bra_close ORDER BY DESC( var_pop) OFFSET 0 LIMIT 1
Welche Stadt hat die meisten Einwohner? <pad> DET NOUN AUX DET DET NOUN PUNCT <pad> nk sb ROOT nk nk oa punct <pad> 3 2 1 3 3 2 2 <pad> ,SELECT DISTINCT var_uri WHERE bra_open var_uri rdf_type dbo_City ; dbo_populationTotal var_pop bra_close ORDER BY DESC( var_pop) OFFSET 0 LIMIT 1
What is Donald Trump's main business? <pad> PRON AUX PROPN PROPN PART ADJ NOUN PUNCT <pad> attr ROOT compound poss case amod nsubj punct <pad> 2 1 4 3 4 3 2 2 <pad> dbr_Donald_Trump,SELECT var_owner WHERE bra_open var_owner dbo_owner dbr_Donald_Trump bra_close 
Was ist Donald Trumps Hauptgeschäftsfeld? <pad> PRON AUX PROPN PROPN PROPN PUNCT <pad> pd ROOT pnc pnc pd punct <pad> 2 1 3 3 2 2 <pad> dbr_Donald_Trump,SELECT var_owner WHERE bra_open var_owner dbo_owner dbr_Donald_Trump bra_close 
When will start the final match of the football world cup 2018? <pad> SCONJ AUX VERB DET ADJ NOUN ADP DET NOUN NOUN PROPN NUM PUNCT <pad> advmod aux ROOT det amod dobj prep det compound compound pobj nummod punct <pad> 2 2 1 3 3 2 3 5 6 5 4 5 2 <pad> dbr_2018_FIFA_World_Cup,SELECT var_Date WHERE bra_open dbr_2018_FIFA_World_Cup dbp_date var_Date bra_close ORDER BY DESC( var_Date) LIMIT 1
Wann ist das Finale der Fußballweltmeisterschaft 2018? <pad> ADV AUX DET NOUN DET NOUN NUM PUNCT <pad> mo ROOT nk sb nk ag nk punct <pad> 2 1 3 2 4 3 4 2 <pad> dbr_2018_FIFA_World_Cup,SELECT var_Date WHERE bra_open dbr_2018_FIFA_World_Cup dbp_date var_Date bra_close ORDER BY DESC( var_Date) LIMIT 1
Which films did Stanley Kubrick direct? <pad> DET NOUN AUX PROPN PROPN ADJ PUNCT <pad> det nsubj aux compound nsubj ROOT punct <pad> 4 3 2 3 2 1 2 <pad> res_Stanley_Kubrick,SELECT DISTINCT var_uri WHERE bra_open var_uri dbo_director res_Stanley_Kubrick bra_close 
Bei welchen Filmen hat Stanley Kubrick Regie geführt? <pad> ADP DET NOUN AUX PROPN PROPN NOUN VERB PUNCT <pad> mo nk nk ROOT sb pnc oa oc punct <pad> 3 5 4 1 2 4 3 2 2 <pad> res_Stanley_Kubrick,SELECT DISTINCT var_uri WHERE bra_open var_uri dbo_director res_Stanley_Kubrick bra_close 
how much is the population Iraq? <pad> SCONJ ADJ AUX DET NOUN PROPN PUNCT <pad> advmod acomp ROOT det nsubj appos punct <pad> 3 2 1 3 2 3 2 <pad> dbr_Iraq,SELECT var_pIraq WHERE bra_open dbr_Iraq dbo_populationTotal var_pIraq bra_close 
Wie viele Einwohner hat der Irak? <pad> ADV DET NOUN VERB DET PROPN PUNCT <pad> cm nk mo ROOT nk sb punct <pad> 3 3 2 1 3 2 2 <pad> dbr_Iraq,SELECT var_pIraq WHERE bra_open dbr_Iraq dbo_populationTotal var_pIraq bra_close 
How many inhabitants does the largest city in Canada have? <pad> SCONJ ADJ NOUN AUX DET ADJ NOUN ADP PROPN VERB PUNCT <pad> advmod amod nsubj aux det amod nsubj prep pobj ROOT punct <pad> 5 4 3 2 3 3 2 3 4 1 2 <pad> res_Canada,SELECT DISTINCT var_num WHERE bra_open res_Canada dbo_largestCity var_city sep_dot var_city dbo_populationTotal var_num bra_close 
Wie viele Einwohner hat die größte Stadt Kanadas? <pad> ADV DET NOUN AUX DET ADJ NOUN PROPN PUNCT <pad> cm nk mo ROOT nk nk sb ag punct <pad> 3 3 2 1 3 3 2 3 2 <pad> res_Canada,SELECT DISTINCT var_num WHERE bra_open res_Canada dbo_largestCity var_city sep_dot var_city dbo_populationTotal var_num bra_close 
Who is the mayor of the capital of French Polynesia? <pad> PRON AUX DET NOUN ADP DET NOUN ADP ADJ PROPN PUNCT <pad> attr ROOT det nsubj prep det pobj prep amod pobj punct <pad> 2 1 3 2 3 5 4 5 7 6 2 <pad> res_French_Polynesia,SELECT DISTINCT var_uri WHERE bra_open res_French_Polynesia dbo_capital var_x sep_dot var_x dbo_mayor var_uri bra_close 
Wer ist der Bürgermeister der größten Stadt in Französich-Polynesien? <pad> PRON AUX DET NOUN DET ADJ NOUN ADP NOUN PUNCT <pad> sb ROOT nk pd nk nk ag mnr nk punct <pad> 2 1 3 2 4 4 3 4 5 2 <pad> res_French_Polynesia,SELECT DISTINCT var_uri WHERE bra_open res_French_Polynesia dbo_capital var_x sep_dot var_x dbo_mayor var_uri bra_close 
Give me all actors starring in movies directed by William Shatner. <pad> VERB PRON DET NOUN VERB ADP NOUN VERB ADP PROPN PROPN PUNCT <pad> ROOT dative det dobj acl prep pobj acl agent compound pobj punct <pad> 1 2 3 2 3 4 5 6 7 9 8 2 <pad> res_William_Shatner,SELECT DISTINCT var_uri WHERE bra_open var_x dbo_director res_William_Shatner ; dbo_starring var_uri bra_close 
"Liste alle Schauspieler auf, die in Filmen mitgespielt haben, für die William Shatner Regie geführt hat. <pad> NOUN DET NOUN ADP PUNCT PRON ADP NOUN VERB AUX PUNCT ADP DET NOUN ADJ NOUN VERB AUX PUNCT <pad> ROOT nk oa svp punct sb mo nk oc rc punct mo nk nk nk ag oc oc punct <pad> 1 3 2 2 2 3 4 5 3 2 3 6 8 7 9 8 5 4 2 <pad> res_William_Shatner",SELECT DISTINCT var_uri WHERE bra_open var_x dbo_director res_William_Shatner ; dbo_starring var_uri bra_close 
How tall is Claudia Schiffer? <pad> SCONJ ADJ AUX PROPN PROPN PUNCT <pad> advmod acomp ROOT compound nsubj punct <pad> 3 2 1 3 2 2 <pad> res_Claudia_Schiffer,SELECT DISTINCT var_height WHERE bra_open res_Claudia_Schiffer dbo_height var_height bra_close 
Wie groß ist Claudia Schiffer? <pad> ADV ADV AUX PROPN PROPN PUNCT <pad> mo pd ROOT pnc sb punct <pad> 3 2 1 3 2 2 <pad> res_Claudia_Schiffer,SELECT DISTINCT var_height WHERE bra_open res_Claudia_Schiffer dbo_height var_height bra_close 
how much is the population densty rank of germany? <pad> SCONJ ADJ AUX DET NOUN NOUN PROPN ADP PROPN PUNCT <pad> advmod acomp ROOT det compound compound nsubj prep pobj punct <pad> 3 2 1 3 4 3 2 3 4 2 <pad> dbr_Germany,SELECT var_rank WHERE bra_open dbr_Germany dbp_populationDensityRank var_rank bra_close 
Auf welchem Platz steht Deutschland messen an der Bevölkerungsdichte? <pad> ADP DET NOUN VERB PROPN VERB ADP DET NOUN PUNCT <pad> mo nk nk ROOT sb sb op nk nk punct <pad> 2 4 3 1 3 2 3 5 4 2 <pad> dbr_Germany,SELECT var_rank WHERE bra_open dbr_Germany dbp_populationDensityRank var_rank bra_close 
What is the highest mountain in Italy? <pad> PRON AUX DET ADJ NOUN ADP PROPN PUNCT <pad> attr ROOT det amod nsubj prep pobj punct <pad> 2 1 3 3 2 3 4 2 <pad> res_Italy,SELECT DISTINCT var_uri WHERE bra_open var_uri rdf_type dbo_Mountain ; dbo_locatedInArea res_Italy ; dbo_elevation var_num bra_close ORDER BY DESC( var_num) OFFSET 0 LIMIT 1
Wie heißt der höchste Berg Italiens? <pad> ADV VERB DET ADJ NOUN PROPN PUNCT <pad> mo ROOT nk nk sb ag punct <pad> 2 1 3 3 2 3 2 <pad> res_Italy,SELECT DISTINCT var_uri WHERE bra_open var_uri rdf_type dbo_Mountain ; dbo_locatedInArea res_Italy ; dbo_elevation var_num bra_close ORDER BY DESC( var_num) OFFSET 0 LIMIT 1
List all games by GMT. <pad> VERB DET NOUN ADP PROPN PUNCT <pad> ROOT det dobj prep pobj punct <pad> 1 3 2 3 4 2 <pad> res_GMT_Games,SELECT DISTINCT var_uri WHERE bra_open var_uri dbo_publisher res_GMT_Games bra_close 
Liste alle Spiele von GMT auf. <pad> NOUN DET NOUN ADP PROPN ADP PUNCT <pad> ROOT nk oa pg nk svp punct <pad> 1 3 2 3 4 2 2 <pad> res_GMT_Games,SELECT DISTINCT var_uri WHERE bra_open var_uri dbo_publisher res_GMT_Games bra_close 
What is the official language of Suriname? <pad> PRON AUX DET ADJ NOUN ADP PROPN PUNCT <pad> attr ROOT det amod nsubj prep pobj punct <pad> 2 1 3 3 2 3 4 2 <pad> res_Suriname,SELECT DISTINCT var_uri WHERE bra_open res_Suriname dbo_officialLanguage var_uri bra_close 
Welches ist die offizielle Sprache in Surinami? <pad> PRON AUX DET ADJ NOUN ADP PROPN PUNCT <pad> sb ROOT nk nk pd mnr nk punct <pad> 2 1 3 3 2 3 4 2 <pad> res_Suriname,SELECT DISTINCT var_uri WHERE bra_open res_Suriname dbo_officialLanguage var_uri bra_close 
In which city did Nikos Kazantzakis die? <pad> ADP DET NOUN AUX PROPN PROPN VERB PUNCT <pad> prep det nsubj aux compound nsubj ROOT punct <pad> 2 4 3 2 3 2 1 2 <pad> res_Nikos_Kazantzakis,SELECT DISTINCT var_uri WHERE bra_open res_Nikos_Kazantzakis dbo_deathPlace var_uri sep_dot var_uri rdf_type dbo_Town bra_close 
In welcher Stadt ist Nikos Kazantzakis gestorben? <pad> ADP DET NOUN AUX PROPN PROPN VERB PUNCT <pad> mo nk nk ROOT pnc sb oc punct <pad> 3 5 4 1 3 2 2 2 <pad> res_Nikos_Kazantzakis,SELECT DISTINCT var_uri WHERE bra_open res_Nikos_Kazantzakis dbo_deathPlace var_uri sep_dot var_uri rdf_type dbo_Town bra_close 
What is in a chocolate chip cookie? <pad> PRON AUX ADP DET NOUN NOUN NOUN PUNCT <pad> nsubj ROOT prep det compound compound pobj punct <pad> 2 1 2 4 5 4 3 2 <pad> res_Chocolate_chip_cookie,SELECT DISTINCT var_uri WHERE bra_open res_Chocolate_chip_cookie dbo_ingredient var_uri bra_close 
Welche Zutaten gehören in einen Schokoladenkeks? <pad> DET NOUN VERB ADP DET NOUN PUNCT <pad> nk sb ROOT mo nk nk punct <pad> 3 2 1 2 4 3 2 <pad> res_Chocolate_chip_cookie,SELECT DISTINCT var_uri WHERE bra_open res_Chocolate_chip_cookie dbo_ingredient var_uri bra_close 
In which country is the Limerick Lake? <pad> ADP DET NOUN AUX DET PROPN PROPN PUNCT <pad> prep det nsubj ROOT det compound attr punct <pad> 2 3 2 1 3 3 2 2 <pad> res_Limerick_Lake,SELECT DISTINCT var_uri WHERE bra_open res_Limerick_Lake dbo_country var_uri bra_close 
In welchem Land liegt der Limerick Lake? <pad> ADP DET NOUN VERB DET NOUN PROPN PUNCT <pad> mo nk nk ROOT nk pnc sb punct <pad> 2 4 3 1 3 3 2 2 <pad> res_Limerick_Lake,SELECT DISTINCT var_uri WHERE bra_open res_Limerick_Lake dbo_country var_uri bra_close 
Give me all video games published by Mean Hamster Software. <pad> VERB PRON DET NOUN NOUN VERB ADP PROPN PROPN PROPN PUNCT <pad> ROOT dative det compound dobj acl agent compound compound pobj punct <pad> 1 2 3 3 2 3 4 6 6 5 2 <pad> res_Mean_Hamster_Software,SELECT DISTINCT var_uri WHERE bra_open var_uri rdf_type dbo_VideoGame ; dbo_publisher res_Mean_Hamster_Software bra_close 
"Liste alle Spiele auf, die von Mean Hamster Software veröffentlicht wurden. <pad> NOUN DET NOUN ADP PUNCT DET ADP PROPN ADJ NOUN VERB AUX PUNCT <pad> ROOT nk oa svp punct sb sbp pnc nk nk oc rc punct <pad> 1 3 2 2 2 3 4 6 5 6 3 2 2 <pad> res_Mean_Hamster_Software",SELECT DISTINCT var_uri WHERE bra_open var_uri rdf_type dbo_VideoGame ; dbo_publisher res_Mean_Hamster_Software bra_close 
Give me all members of Prodigy. <pad> VERB PRON DET NOUN ADP PROPN PUNCT <pad> ROOT dative det dobj prep pobj punct <pad> 1 2 3 2 3 4 2 <pad> res_The_Prodigy,SELECT DISTINCT var_uri WHERE bra_open res_The_Prodigy dbo_bandMember var_uri bra_close 
Gib mir alle Prodji-Teilnehmer. <pad> NOUN PRON DET NOUN PUNCT <pad> ROOT da nk pd punct <pad> 1 2 3 2 2 <pad> res_The_Prodigy,SELECT DISTINCT var_uri WHERE bra_open res_The_Prodigy dbo_bandMember var_uri bra_close 
Donne-moi tous les membres de Prodiji. <pad> PROPN PRON ADJ DET NOUN ADP PROPN PUNCT <pad> ROOT dep amod det obj case nmod punct <pad> 1 2 3 3 2 4 3 2 <pad> res_The_Prodigy,SELECT DISTINCT var_uri WHERE bra_open res_The_Prodigy dbo_bandMember var_uri bra_close 
In which time zone is Rome? <pad> ADP DET NOUN NOUN AUX PROPN PUNCT <pad> prep det compound nsubj ROOT attr punct <pad> 2 4 3 2 1 2 2 <pad> res_Rome,SELECT DISTINCT var_uri WHERE bra_open res_Rome dbo_timeZone var_uri bra_close 
In welcher Zeitzone befindet sich Rom? <pad> ADP DET NOUN VERB PRON PROPN PUNCT <pad> mo nk nk ROOT oa sb punct <pad> 2 4 3 1 2 2 2 <pad> res_Rome,SELECT DISTINCT var_uri WHERE bra_open res_Rome dbo_timeZone var_uri bra_close 
Dans quel fuseau horaire se trouve Rome? <pad> ADP DET NOUN NOUN PRON VERB PROPN PUNCT <pad> case det nsubj nmod expl:comp ROOT obl:arg punct <pad> 3 3 2 3 2 1 2 2 <pad> res_Rome,SELECT DISTINCT var_uri WHERE bra_open res_Rome dbo_timeZone var_uri bra_close 
How high is the lighthouse in Colombo? <pad> SCONJ ADJ AUX DET NOUN ADP PROPN PUNCT <pad> advmod acomp ROOT det nsubj prep pobj punct <pad> 3 2 1 3 2 3 4 2 <pad> res_Colombo_Lighthouse,SELECT DISTINCT var_num WHERE bra_open res_Colombo_Lighthouse dbo_height var_num bra_close 
